### ISSUE TITLE
Couldn't find any Elasticsearch data

### ISSUE THREAD

**Issue by oddworld19** [pfelk/pfelk#105]
**Describe the bug**
Couldn't find any Elasticsearch data

oddworld@PfSenseLogDeb:~$ cat /etc/debian_version
9.12

Confirmed with packet capture tools that pfsense is sending logs to newly created logVM. 

Suspect this pertails to 35-rules-desc.conf. Copied below is my config file. 

```
# 35-rules-desc.conf
#################################################
# Checks for the presense of the tracker field, #
# if present runs translates the tracker into a #
# referenced description.                       #
#################################################
filter {
  if [tracker] {
    translate {
      field => "[tracker]"
      destination => "[rule][description]"
      dictionary => {
      "0" => "null"
      "1565145966" => "Allow MGMT to Firewall"
      "1565148094" => "NAT WAN to RemoteDesktopWin7"
      "1565148117" => "NAT WAN to G9WIN10"
      "1565148127" => "NAT WAN to HTPC"
      "1565148145" => "NAT WAN to ArchPlex"
      "1565148153" => "NAT WAN to NextCloud"
      "1565148174" => "NAT WAN to NextCloud"
      "1565150601" => "Allow LAN to Anywhere"
      "1565150688" => "Allow Wifi20 to Anywhere"
      "1565150788" => "Allow Guest30 to WAN"
      "1565150822" => "Block Guest30 from Firewall"
      "1565150891" => "Allow Security40 to DAZ"
      "1565150918" => "Allow Security40 to BlueIris"
      "1565150953" => "Block Security40 from Firewall"
      "1565151003" => "Allow Security40 to Security40"
      "1565151347" => "Allow Subsonic to NAS70"
      "1565151568" => "Allow RemoteDesktopWin7 to Anywhere"
      "1565151632" => "Allow DMZ50 to WAN"
      "1565151700" => "Block DMZ50 from Firewall"
      "1565225970" => "OpenVPN InboundVPN wizard"
      "1565225971" => "OpenVPN InboundVPN wizard"
      "1565665058" => "Allow VPN60 to ArchWorkstation"
      "1565665072" => "Allow VPN60 to AptCache"
      "1565665112" => "Allow VPN60 to NAS70"
      "1565665150" => "Allow VPN60 to VPN60"
      "1565665174" => "Block VPN60 Firewall"
      "1565665300" => "Allow NAS70 to Any"
      "1565665345" => "Allow VOIP80 Internet"
      "1565665444" => "Allow Cloud55 Internet"
      "1565666303" => "Allow VPN60 to VPN-WAN"
      "1565666343" => "Block VPN60 from WAN"
      "1565666421" => "Allow InboundVPN to any"
      "1565727826" => "Block VPNTAG Traffic from WAN"
      "1574710711" => "Block VPN65 from WAN"
      "1574712458" => "Allow VPN65 to VPN65"
      "1574718169" => "Block MVPN Traffic from WAN"
      "1574749471" => "Allow MGMT to Any"
      "1579670657" => "Allow Guest30 to Mullvad WAN"
      "1579670840" => "Block SuperMicro to WAN (no GW)"
      "1579670923" => "Allow Guest30 to LAN"
      "1579671039" => "Allow Guest30 to Wifi20"
      "1579671061" => "Allow Guest30 to NAS70"
      "1579671104" => "Block SuperMicro to WAN (GW)"
      "1580876538" => "Allow Security40 to KindleFireDAZ"
      "1580879295" => "Block VPN65 to WAN (no GW)"
      "1580879334" => "Block VPN65 to WAN (GW)"
      "1580879396" => "Allow VPN65 to Mullvad WAN Alias"
      "1580879433" => "Allow VPN65 to LAN"
      "1581490714" => "Allow Security40 to DAZ"
      "1581491601" => "Allow Security40 to RPiCAM"

      #Add additional rule descriptions here
      #"00000" => "this is a rule description example"
      
      }
      fallback => "no match"
    }
  }
  if [rule][description] {
    mutate {
      add_tag => "Rule_Description"
    }
  }
}

```

**Screenshots**
https://imgur.com/KTlp0wy

**Operating System (please complete the following information):**
 - OS (`printf "$(uname -srm)\n$(cat /etc/os-release)\n"`):

oddworld@PfSenseLogDeb:~$ printf "$(uname -srm)\n$(cat /etc/os-release)\n"
Linux 4.9.0-12-amd64 x86_64
PRETTY_NAME="Debian GNU/Linux 9 (stretch)"
NAME="Debian GNU/Linux"
VERSION_ID="9"
VERSION="9 (stretch)"
VERSION_CODENAME=stretch
ID=debian
HOME_URL="https://www.debian.org/"
SUPPORT_URL="https://www.debian.org/support"
BUG_REPORT_URL="https://bugs.debian.org/"

 
**Elasticsearch, Logstash, Kibana (please complete the following information):**
 - Version of ELK (`dpkg -l elasticsearch|logstash|kibana`)

`oddworld@PfSenseLogDeb:~$ sudo dpkg -l logstash
Desired=Unknown/Install/Remove/Purge/Hold
| Status=Not/Inst/Conf-files/Unpacked/halF-conf/Half-inst/trig-aWait/Trig-pend
|/ Err?=(none)/Reinst-required (Status,Err: uppercase=bad)
||/ Name                                                           Version                              Architecture                         Description
+++-==============================================================-====================================-====================================-==================================================================================================================================
ii  logstash                                                       1:7.6.2-1                            all                                  An extensible logging pipeline
oddworld@PfSenseLogDeb:~$ sudo dpkg -l elasticsearch
Desired=Unknown/Install/Remove/Purge/Hold
| Status=Not/Inst/Conf-files/Unpacked/halF-conf/Half-inst/trig-aWait/Trig-pend
|/ Err?=(none)/Reinst-required (Status,Err: uppercase=bad)
||/ Name                                                           Version                              Architecture                         Description
+++-==============================================================-====================================-====================================-==================================================================================================================================
ii  elasticsearch                                                  7.6.2                                amd64                                Distributed RESTful search engine built for the cloud
oddworld@PfSenseLogDeb:~$ sudo dpkg -l kibana
Desired=Unknown/Install/Remove/Purge/Hold
| Status=Not/Inst/Conf-files/Unpacked/halF-conf/Half-inst/trig-aWait/Trig-pend
|/ Err?=(none)/Reinst-required (Status,Err: uppercase=bad)
||/ Name                                                           Version                              Architecture                         Description
+++-==============================================================-====================================-====================================-==================================================================================================================================
ii  kibana                                                         7.6.2                                amd64                                Explore and visualize your Elasticsearch data
`

**Comment by a3ilson** [comment]
remove or change the extension of 35-rules-desc.conf. Next, restart logstash.  Let it run a bit...create the index pattern and then try readding 35-rules-desc.conf

**Comment by oddworld19** [comment]
Dang you're fast. Really appreciate it. 

Moved and restarted per the commands below. Will give it a few minutes before adding it back. 

```
oddworld@PfSenseLogDeb:/etc/logstash/conf.d$ sudo mv /etc/logstash/conf.d/35-rules-desc.conf /etc/logstash/conf.d/35-rules-desc.conf.moved
oddworld@PfSenseLogDeb:/etc/logstash/conf.d$ sudo systemctl restart logstash.service

```

**Comment by a3ilson** [comment]
@oddworld19 - I believe there may be something else going on...I'm helping someone else out with the same issue... it'll work without the 35-rules-desc.conf but give me a few to troubleshoot what's going on

**Comment by oddworld19** [comment]
Sweet, thanks. Just ping me with things to try, logs, or whatever else you need. Happy to help however I can.

**Comment by oddworld19** [comment]
If helpful, below are my configs:


```
`# 01-inputs.conf
input {
  udp {
    port => 5140
  }
}

filter {
#########################################################
# Adjust to match the IP address of pfSense or OPNsense #
#########################################################
  if [host] =~ /192\.168\.10\.1/ {
    mutate {
      add_tag => [ "pf", "Ready" ]
      add_field => [ "[observer][type]", "firewall" ]
    }
  }
#########################################################################################
#To enable or ingest multiple pfSense or OPNsense instances uncomment the below section #
#########################################################################################
#if [host] =~ /172\.2\.22\.1/ {
#  mutate {
#    add_tag => ["pf", "Ready"]
#    add_field => [ "[observer][type]", "firewall" ]
#  }
#}
#########################################################################################
  if "pf" in [tags] {
    grok {
      # OPNsense - Enable/Disable the line below based on firewall platform
      # match => { "message" => "<(?<[event][id]>.*)>%{SYSLOGTIMESTAMP:[event][created]} %{SYSLOGHOST:[observer][name]} %{DATA:labels}(?:\[%{POSINT:pf_pid}\])?: %{GREEDYDATA:pf_message}" }
      ########################################################################################################################################
      # pfSense - Enable/Disable the line below based on firewall platform
      match => { "message" => "<(?<[event][id]>.*)>%{SYSLOGTIMESTAMP:[event][created]} %{DATA:labels}(?:\[%{POSINT:[event][id]}\])?: %{GREEDYDATA:pf_message}" }
    }
    mutate {
      rename => { "[message]" => "[event][original]"}
      remove_tag => "Ready"
    }
  }
}
`
```


kibana.yml

````
# Kibana is served by a back end server. This setting specifies the port to use.
server.port: 5601

# Specifies the address to which the Kibana server will bind. IP addresses and host names are both valid values.
# The default is 'localhost', which usually means remote machines will not be able to connect.
# To allow connections from remote users, set this parameter to a non-loopback address.
server.host: "0.0.0.0"
`
```

**Comment by a3ilson** [comment]
@oddworld19 - the issues is with the field type.  I'm working/testing it now....essentially, I'll need to convert the tracker field to a string

**Comment by oddworld19** [comment]
Sweet - thanks. I'm around the next few hours if you want a test dummy.

**Comment by a3ilson** [comment]
@oddworld19 - I'll take you up on that offer.... adjust your 35-rule-desc.conf file as follows:

```
# 35-rules-desc.conf
#################################################
# Checks for the presense of the tracker field, #
# if present runs translates the tracker into a #
# referenced description.                       #
#################################################
filter {
  if [tracker] {
    mutate {
      convert => ["tracker", "string"]
    }
  }
  if [tracker] {
    translate {
      field => "[tracker]"
      destination => "[rule][description]"
      dictionary => {
      "0" => "null"
      "1565145966" => "Allow MGMT to Firewall"
      "1565148094" => "NAT WAN to RemoteDesktopWin7"
      "1565148117" => "NAT WAN to G9WIN10"
      "1565148127" => "NAT WAN to HTPC"
      "1565148145" => "NAT WAN to ArchPlex"
      "1565148153" => "NAT WAN to NextCloud"
      "1565148174" => "NAT WAN to NextCloud"
      "1565150601" => "Allow LAN to Anywhere"
      "1565150688" => "Allow Wifi20 to Anywhere"
      "1565150788" => "Allow Guest30 to WAN"
      "1565150822" => "Block Guest30 from Firewall"
      "1565150891" => "Allow Security40 to DAZ"
      "1565150918" => "Allow Security40 to BlueIris"
      "1565150953" => "Block Security40 from Firewall"
      "1565151003" => "Allow Security40 to Security40"
      "1565151347" => "Allow Subsonic to NAS70"
      "1565151568" => "Allow RemoteDesktopWin7 to Anywhere"
      "1565151632" => "Allow DMZ50 to WAN"
      "1565151700" => "Block DMZ50 from Firewall"
      "1565225970" => "OpenVPN InboundVPN wizard"
      "1565225971" => "OpenVPN InboundVPN wizard"
      "1565665058" => "Allow VPN60 to ArchWorkstation"
      "1565665072" => "Allow VPN60 to AptCache"
      "1565665112" => "Allow VPN60 to NAS70"
      "1565665150" => "Allow VPN60 to VPN60"
      "1565665174" => "Block VPN60 Firewall"
      "1565665300" => "Allow NAS70 to Any"
      "1565665345" => "Allow VOIP80 Internet"
      "1565665444" => "Allow Cloud55 Internet"
      "1565666303" => "Allow VPN60 to VPN-WAN"
      "1565666343" => "Block VPN60 from WAN"
      "1565666421" => "Allow InboundVPN to any"
      "1565727826" => "Block VPNTAG Traffic from WAN"
      "1574710711" => "Block VPN65 from WAN"
      "1574712458" => "Allow VPN65 to VPN65"
      "1574718169" => "Block MVPN Traffic from WAN"
      "1574749471" => "Allow MGMT to Any"
      "1579670657" => "Allow Guest30 to Mullvad WAN"
      "1579670840" => "Block SuperMicro to WAN (no GW)"
      "1579670923" => "Allow Guest30 to LAN"
      "1579671039" => "Allow Guest30 to Wifi20"
      "1579671061" => "Allow Guest30 to NAS70"
      "1579671104" => "Block SuperMicro to WAN (GW)"
      "1580876538" => "Allow Security40 to KindleFireDAZ"
      "1580879295" => "Block VPN65 to WAN (no GW)"
      "1580879334" => "Block VPN65 to WAN (GW)"
      "1580879396" => "Allow VPN65 to Mullvad WAN Alias"
      "1580879433" => "Allow VPN65 to LAN"
      "1581490714" => "Allow Security40 to DAZ"
      "1581491601" => "Allow Security40 to RPiCAM"

      #Add additional rule descriptions here
      #"00000" => "this is a rule description example"
      
      }
      fallback => "no match"
    }
  }
  if [rule][description] {
    mutate {
      add_tag => "Rule_Description"
    }
  }
}
```

**Comment by oddworld19** [comment]
Done and done. 

```
oddworld@PfSenseLogDeb:/etc/logstash/conf.d$ sudo nano /etc/logstash/conf.d/35-rules-desc.conf
oddworld@PfSenseLogDeb:/etc/logstash/conf.d$ sudo systemctl restart logstash.service

```

Did another packet capture. Odd result here:

```

17:02:11.176477 IP 192.168.10.1.514 > 192.168.10.126.5140: UDP, length 312
17:02:11.176663 IP 192.168.10.126 > 192.168.10.1: ICMP 192.168.10.126 udp port 5140 unreachable, length 348
17:02:11.178471 IP 192.168.10.1.514 > 192.168.10.126.5140: UDP, length 311
17:02:11.178600 IP 192.168.10.126 > 192.168.10.1: ICMP 192.168.10.126 udp port 5140 unreachable, length 347
17:02:11.180765 IP 192.168.10.1.514 > 192.168.10.126.5140: UDP, length 283
17:02:11.180896 IP 192.168.10.126 > 192.168.10.1: ICMP 192.168.10.126 udp port 5140 unreachable, length 319
17:02:31.109370 IP 192.168.10.1.514 > 192.168.10.126.5140: UDP, length 163
17:02:31.109578 IP 192.168.10.126 > 192.168.10.1: ICMP 192.168.10.126 udp port 5140 unreachable, length 199
17:02:41.109199 IP 192.168.10.1.514 > 192.168.10.126.5140: UDP, length 161
17:02:41.109395 IP 192.168.10.126 > 192.168.10.1: ICMP 192.168.10.126 udp port 5140 unreachable, length 197

```

**Comment by a3ilson** [comment]
are you running ufw?

**Comment by oddworld19** [comment]
Nope - just checked.

**Comment by a3ilson** [comment]
We'll your receiving logs and your pings are being blocked or so that's what it appears.

**Comment by a3ilson** [comment]
So with the change are you up and running?

**Comment by oddworld19** [comment]
Still seeing "Couldn't find any Elasticsearch data"

Should I reboot?

**Comment by a3ilson** [comment]
Awe...
I just noticed your running debian 9

**Comment by a3ilson** [comment]
Have an open issue on Debian 9/10 as logs don't appear to be received by logstash.

**Comment by oddworld19** [comment]
Can try with a different OS. What's best supported?

**Comment by a3ilson** [comment]
Ubuntu works best...tested with v18.04

**Comment by a3ilson** [comment]
Sorry...working on figuring out the Debian issue

**Comment by oddworld19** [comment]
No prob at all. It's just a VM. Will spin up a 18.04.

**Comment by oddworld19** [comment]
18.04 works without a hitch. Might steer people that way since I suspect most will be installing on a fresh VM without strong preferences between the two. Worth mentioning that to the extent Debian 9 is used, I needed to install Java 11 from backports (so script missed that, as well as logstash due to missing Java dependency). An earlier version is available without backports, but unsure whether it would work or cause issues.

**Comment by a3ilson** [comment]
Thanks! I'll close this issue and open another specific to Debian 9/10.
