### ISSUE TITLE
Dashboards not working

### ISSUE THREAD

**Issue by spidershark45** [pfelk/pfelk#224]
**Describe the bug**
I'm having an issue where I am not getting any data displayed on the 3x dashboards I've installed (DHCP, Firewall and Suricata). This seems to be a similar issue to #223 . I have run through the install script a couple of time on fresh VMs to make sure I didn't make a mistake during the install and config, but have had the same problem.

pfelk is running in a vm (vmware workstation), pfsense is a physical box.

 I did a tcpdump on the pfelk box and it appears to be receiving data from the pfsense box okay:

listening on ens33, link-type EN10MB (Ethernet), capture size 262144 bytes
08:43:59.057538 IP _gateway.syslog > elk3.5140: SYSLOG local0.info, length: 162
08:43:59.058200 IP _gateway.syslog > elk3.5140: SYSLOG local0.info, length: 140
08:43:59.058203 IP _gateway.syslog > elk3.5140: SYSLOG local0.info, length: 132
08:43:59.216925 IP _gateway.syslog > elk3.5140: SYSLOG local1.notice, length: 356
08:43:59.216958 IP _gateway.syslog > elk3.5140: SYSLOG local1.notice, length: 364
08:43:59.217014 IP _gateway.syslog > elk3.5140: SYSLOG local1.notice, length: 433
08:43:59.217017 IP _gateway.syslog > elk3.5140: SYSLOG local1.notice, length: 441
08:43:59.722083 IP _gateway.syslog > elk3.5140: SYSLOG local1.notice, length: 366
08:43:59.722112 IP _gateway.syslog > elk3.5140: SYSLOG local1.notice, length: 480
08:43:59.722115 IP _gateway.syslog > elk3.5140: SYSLOG local1.notice, length: 374
08:44:00.078108 IP _gateway.syslog > elk3.5140: SYSLOG local0.info, length: 160
08:44:00.078810 IP _gateway.syslog > elk3.5140: SYSLOG local0.info, length: 139
08:44:00.078816 IP _gateway.syslog > elk3.5140: SYSLOG local0.info, length: 189
08:44:00.078817 IP _gateway.syslog > elk3.5140: SYSLOG local0.info, length: 144
08:44:00.078818 IP _gateway.syslog > elk3.5140: SYSLOG local0.info, length: 188
08:44:00.227259 IP _gateway.syslog > elk3.5140: SYSLOG local1.notice, length: 480
08:44:00.737450 IP _gateway.syslog > elk3.5140: SYSLOG local1.notice, length: 480
08:44:01.140338 IP _gateway.syslog > elk3.5140: SYSLOG local0.info, length: 188

**Screenshots**
https://imgur.com/cFGy7Az
https://imgur.com/sCgnflY
https://imgur.com/rleJJFu

**Firewall System (please complete the following information):**
pfSense
Version: 2.4.5-RELEASE-p1 (amd64) 
 
**Operating System (please complete the following information):**
Linux 5.4.0-58-generic x86_64
NAME="Ubuntu"
VERSION="18.04.5 LTS (Bionic Beaver)"
ID=ubuntu
ID_LIKE=debian
PRETTY_NAME="Ubuntu 18.04.5 LTS"
VERSION_ID="18.04"
HOME_URL="https://www.ubuntu.com/"
SUPPORT_URL="https://help.ubuntu.com/"
BUG_REPORT_URL="https://bugs.launchpad.net/ubuntu/"
PRIVACY_POLICY_URL="https://www.ubuntu.com/legal/terms-and-policies/privacy-policy"
VERSION_CODENAME=bionic
UBUNTU_CODENAME=bionic
 
 **Installation method (manual, ansible-playbook, docker, script):**
Script (pfelk-install-6.0.sh)
 
**Elasticsearch, Logstash, Kibana (please complete the following information):**
+++-===============================================-============================-============================-===================================================================================================
ii  elasticsearch                                   7.10.0                       amd64                        Distributed RESTful search engine built for the cloud

+++-===============================================-============================-============================-===================================================================================================
ii  logstash                                        1:7.10.0-1                   amd64                        An extensible logging pipeline

+++-===============================================-============================-============================-===================================================================================================
ii  kibana                                          7.10.0                       amd64                        Explore and visualize your Elasticsearch data
 
 **Elasticsearch, Logstash, Kibana logs:**
 - Elasticsearch logs (`tail -f /var/log/elasticsearch/[your-elk-cluster-name].log`)
        at org.elasticsearch.action.search.AbstractSearchAsyncAction.lambda$performPhaseOnShard$0(AbstractSearchAsyncAction.java:236) [elasticsearch-7.10.0.jar:7.10.0]
        at org.elasticsearch.action.search.AbstractSearchAsyncAction$2.doRun(AbstractSearchAsyncAction.java:303) [elasticsearch-7.10.0.jar:7.10.0]
        at org.elasticsearch.common.util.concurrent.ThreadContext$ContextPreservingAbstractRunnable.doRun(ThreadContext.java:737) [elasticsearch-7.10.0.jar:7.10.0]
        at org.elasticsearch.common.util.concurrent.AbstractRunnable.run(AbstractRunnable.java:37) [elasticsearch-7.10.0.jar:7.10.0]
        at java.util.concurrent.ThreadPoolExecutor.runWorker(ThreadPoolExecutor.java:1130) [?:?]
        at java.util.concurrent.ThreadPoolExecutor$Worker.run(ThreadPoolExecutor.java:630) [?:?]
        at java.lang.Thread.run(Thread.java:832) [?:?]
[2020-12-20T08:13:57,699][INFO ][o.e.c.r.a.AllocationService] [elk3] Cluster health status changed from [RED] to [YELLOW] (reason: [shards started [[pfelk-snort-000001][0]]]).
[2020-12-20T08:13:59,440][INFO ][o.e.c.m.MetadataIndexTemplateService] [elk3] adding template [.management-beats] for index patterns [.management-beats]
[2020-12-20T08:16:03,790][INFO ][o.e.c.m.MetadataMappingService] [elk3] [pfelk-firewall-000001/H9RLqXvkRQO62kzX9xC-Qg] update_mapping [_doc]

 - Logstash logs (`tail -f /var/log/logstash/logstash-plain.log`)
[2020-12-20T08:14:09,252][INFO ][logstash.inputs.udp      ][main][pfelk-haproxy] Starting UDP listener {:address=>"0.0.0.0:5190"}
[2020-12-20T08:14:09,257][INFO ][logstash.inputs.udp      ][main][pfelk-2] Starting UDP listener {:address=>"0.0.0.0:5141"}
[2020-12-20T08:14:09,290][INFO ][org.logstash.beats.Server][main][Beats] Starting server on port: 5044
[2020-12-20T08:14:09,334][INFO ][logstash.inputs.udp      ][main][pfelk-1] Starting UDP listener {:address=>"0.0.0.0:5140"}
[2020-12-20T08:14:09,386][INFO ][logstash.agent           ] Pipelines running {:count=>1, :running_pipelines=>[:main], :non_running_pipelines=>[]}
[2020-12-20T08:14:09,397][INFO ][logstash.inputs.udp      ][main][pfelk-2] UDP listener started {:address=>"0.0.0.0:5141", :receive_buffer_bytes=>"106496", :queue_size=>"2000"}
[2020-12-20T08:14:09,396][INFO ][logstash.inputs.udp      ][main][pfelk-haproxy] UDP listener started {:address=>"0.0.0.0:5190", :receive_buffer_bytes=>"106496", :queue_size=>"2000"}
[2020-12-20T08:14:09,395][INFO ][logstash.inputs.udp      ][main][pfelk-1] UDP listener started {:address=>"0.0.0.0:5140", :receive_buffer_bytes=>"106496", :queue_size=>"2000"}
[2020-12-20T08:14:09,543][INFO ][logstash.agent           ] Successfully started Logstash API endpoint {:port=>9600}
[2020-12-20T08:16:03,753][WARN ][logstash.filters.grok    ][main][6febadf1e5a886f4ce05c3eb02829c20383eda2b0f48aa3fa9240a39420d86d9] Grok regexp threw exception {:exception=>"Could not set field 'action' on object '/index.php' to value ' Successful login'.This is probably due to trying to set a field like [foo][bar] = someValuewhen [foo] is not either a map or a string", :backtrace=>["org.logstash.Accessors.setChild(Accessors.java:142)", "org.logstash.Accessors.set(Accessors.java:36)", "org.logstash.Event.setField(Event.java:208)", "org.logstash.ext.JrubyEventExtLibrary$RubyEvent.ruby_set_field(JrubyEventExtLibrary.java:121)", "usr.share.logstash.vendor.bundle.jruby.$2_dot_5_dot_0.gems.logstash_minus_filter_minus_grok_minus_4_dot_3_dot_0.lib.logstash.filters.grok.RUBY$method$handle$0(/usr/share/logstash/vendor/bundle/jruby/2.5.0/gems/logstash-filter-grok-4.3.0/lib/logstash/filters/grok.rb:414)", "usr.share.logstash.vendor.bundle.jruby.$2_dot_5_dot_0.gems.logstash_minus_filter_minus_grok_minus_4_dot_3_dot_0.lib.logstash.filters.grok.RUBY$block$match$2(/usr/share/logstash/vendor/bundle/jruby/2.5.0/gems/logstash-filter-grok-4.3.0/lib/logstash/filters/grok.rb:372)", "org.jruby.runtime.CompiledIRBlockBody.callDirect(CompiledIRBlockBody.java:138)", "org.jruby.runtime.IRBlockBody.call(IRBlockBody.java:58)", "org.jruby.runtime.Block.call(Block.java:143)", "org.jruby.RubyProc.call(RubyProc.java:299)", "org.jruby.RubyProc$INVOKER$i$call.call(RubyProc$INVOKER$i$call.gen)", "org.jruby.internal.runtime.methods.JavaMethod$JavaMethodZeroOrOneOrTwoOrNBlock.call(JavaMethod.java:371)", "org.jruby.runtime.callsite.CachingCallSite.cacheAndCall(CachingCallSite.java:396)", "org.jruby.runtime.callsite.CachingCallSite.call(CachingCallSite.java:205)", "org.jruby.ir.interpreter.InterpreterEngine.processCall(InterpreterEngine.java:325)", "org.jruby.ir.interpreter.StartupInterpreterEngine.interpret(StartupInterpreterEngine.java:72)", "org.jruby.ir.interpreter.Interpreter.INTERPRET_BLOCK(Interpreter.java:116)", "org.jruby.runtime.MixedModeIRBlockBody.commonYieldPath(MixedModeIRBlockBody.java:137)", "org.jruby.runtime.IRBlockBody.call(IRBlockBody.java:60)", "org.jruby.runtime.Block.call(Block.java:143)", "org.jruby.RubyProc.call(RubyProc.java:275)", "usr.share.logstash.vendor.bundle.jruby.$2_dot_5_dot_0.gems.jls_minus_grok_minus_0_dot_11_dot_5.lib.grok_minus_pure.RUBY$method$capture$0(/usr/share/logstash/vendor/bundle/jruby/2.5.0/gems/jls-grok-0.11.5/lib/grok-pure.rb:202)", "usr.share.logstash.vendor.bundle.jruby.$2_dot_5_dot_0.gems.logstash_minus_filter_minus_grok_minus_4_dot_3_dot_0.lib.logstash.filters.grok.RUBY$block$match$1(/usr/share/logstash/vendor/bundle/jruby/2.5.0/gems/logstash-filter-grok-4.3.0/lib/logstash/filters/grok.rb:372)", "org.jruby.runtime.CompiledIRBlockBody.yieldDirect(CompiledIRBlockBody.java:148)", "org.jruby.runtime.BlockBody.yield(BlockBody.java:106)", "org.jruby.runtime.Block.yield(Block.java:184)", "org.jruby.RubyArray.each(RubyArray.java:1809)", "usr.share.logstash.vendor.bundle.jruby.$2_dot_5_dot_0.gems.logstash_minus_filter_minus_grok_minus_4_dot_3_dot_0.lib.logstash.filters.grok.RUBY$method$match$0(/usr/share/logstash/vendor/bundle/jruby/2.5.0/gems/logstash-filter-grok-4.3.0/lib/logstash/filters/grok.rb:367)", "usr.share.logstash.vendor.bundle.jruby.$2_dot_5_dot_0.gems.logstash_minus_filter_minus_grok_minus_4_dot_3_dot_0.lib.logstash.filters.grok.RUBY$method$match_against_groks$0(/usr/share/logstash/vendor/bundle/jruby/2.5.0/gems/logstash-filter-grok-4.3.0/lib/logstash/filters/grok.rb:353)", "usr.share.logstash.vendor.bundle.jruby.$2_dot_5_dot_0.gems.logstash_minus_filter_minus_grok_minus_4_dot_3_dot_0.lib.logstash.filters.grok.RUBY$method$match_against_groks$0$__VARARGS__(/usr/share/logstash/vendor/bundle/jruby/2.5.0/gems/logstash-filter-grok-4.3.0/lib/logstash/filters/grok.rb)", "org.jruby.internal.runtime.methods.CompiledIRMethod.call(CompiledIRMethod.java:80)", "org.jruby.internal.runtime.methods.MixedModeIRMethod.call(MixedModeIRMethod.java:70)", "org.jruby.ir.targets.InvokeSite.invoke(InvokeSite.java:207)", "usr.share.logstash.vendor.bundle.jruby.$2_dot_5_dot_0.gems.logstash_minus_filter_minus_grok_minus_4_dot_3_dot_0.lib.logstash.filters.grok.RUBY$method$match$0(/usr/share/logstash/vendor/bundle/jruby/2.5.0/gems/logstash-filter-grok-4.3.0/lib/logstash/filters/grok.rb:343)", "usr.share.logstash.vendor.bundle.jruby.$2_dot_5_dot_0.gems.logstash_minus_filter_minus_grok_minus_4_dot_3_dot_0.lib.logstash.filters.grok.RUBY$method$match$0$__VARARGS__(/usr/share/logstash/vendor/bundle/jruby/2.5.0/gems/logstash-filter-grok-4.3.0/lib/logstash/filters/grok.rb)", "org.jruby.internal.runtime.methods.CompiledIRMethod.call(CompiledIRMethod.java:80)", "org.jruby.internal.runtime.methods.MixedModeIRMethod.call(MixedModeIRMethod.java:70)", "org.jruby.ir.targets.InvokeSite.invoke(InvokeSite.java:207)", "usr.share.logstash.vendor.bundle.jruby.$2_dot_5_dot_0.gems.logstash_minus_filter_minus_grok_minus_4_dot_3_dot_0.lib.logstash.filters.grok.RUBY$block$filter$1(/usr/share/logstash/vendor/bundle/jruby/2.5.0/gems/logstash-filter-grok-4.3.0/lib/logstash/filters/grok.rb:307)", "org.jruby.runtime.CompiledIRBlockBody.yieldDirect(CompiledIRBlockBody.java:148)", "org.jruby.runtime.BlockBody.yield(BlockBody.java:106)", "org.jruby.runtime.Block.yield(Block.java:184)", "org.jruby.RubyHash$11.visit(RubyHash.java:1434)", "org.jruby.RubyHash$11.visit(RubyHash.java:1431)", "org.jruby.RubyHash.visitLimited(RubyHash.java:698)", "org.jruby.RubyHash.visitAll(RubyHash.java:683)", "org.jruby.RubyHash.iteratorVisitAll(RubyHash.java:1391)", "org.jruby.RubyHash.each_pairCommon(RubyHash.java:1426)", "org.jruby.RubyHash.each(RubyHash.java:1415)", "usr.share.logstash.vendor.bundle.jruby.$2_dot_5_dot_0.gems.logstash_minus_filter_minus_grok_minus_4_dot_3_dot_0.lib.logstash.filters.grok.RUBY$method$filter$0(/usr/share/logstash/vendor/bundle/jruby/2.5.0/gems/logstash-filter-grok-4.3.0/lib/logstash/filters/grok.rb:306)", "org.jruby.internal.runtime.methods.CompiledIRMethod.call(CompiledIRMethod.java:106)", "org.jruby.internal.runtime.methods.MixedModeIRMethod.call(MixedModeIRMethod.java:140)", "org.jruby.ir.targets.InvokeSite.fail(InvokeSite.java:278)", "usr.share.logstash.logstash_minus_core.lib.logstash.filters.base.RUBY$method$do_filter$0(/usr/share/logstash/logstash-core/lib/logstash/filters/base.rb:159)", "org.jruby.internal.runtime.methods.CompiledIRMethod.call(CompiledIRMethod.java:106)", "org.jruby.internal.runtime.methods.MixedModeIRMethod.call(MixedModeIRMethod.java:140)", "org.jruby.ir.targets.InvokeSite.fail(InvokeSite.java:278)", "usr.share.logstash.logstash_minus_core.lib.logstash.filters.base.RUBY$block$multi_filter$1(/usr/share/logstash/logstash-core/lib/logstash/filters/base.rb:178)", "org.jruby.runtime.CompiledIRBlockBody.yieldDirect(CompiledIRBlockBody.java:148)", "org.jruby.runtime.BlockBody.yield(BlockBody.java:106)", "org.jruby.runtime.Block.yield(Block.java:184)", "org.jruby.RubyArray.each(RubyArray.java:1809)", "usr.share.logstash.logstash_minus_core.lib.logstash.filters.base.RUBY$method$multi_filter$0(/usr/share/logstash/logstash-core/lib/logstash/filters/base.rb:175)", "org.jruby.internal.runtime.methods.CompiledIRMethod.call(CompiledIRMethod.java:106)", "org.jruby.internal.runtime.methods.MixedModeIRMethod.call(MixedModeIRMethod.java:140)", "org.jruby.internal.runtime.methods.DynamicMethod.call(DynamicMethod.java:200)", "org.logstash.config.ir.compiler.FilterDelegatorExt.doMultiFilter(FilterDelegatorExt.java:127)", "org.logstash.config.ir.compiler.AbstractFilterDelegatorExt.multiFilter(AbstractFilterDelegatorExt.java:134)", "org.logstash.generated.CompiledDataset2.compute(Unknown Source)", "org.logstash.generated.CompiledDataset2.compute(Unknown Source)", "org.logstash.generated.CompiledDataset3.compute(Unknown Source)", "org.logstash.generated.CompiledDataset2.compute(Unknown Source)", "org.logstash.generated.CompiledDataset2.compute(Unknown Source)", "org.logstash.generated.CompiledDataset3.compute(Unknown Source)", "org.logstash.generated.CompiledDataset4.compute(Unknown Source)", "org.logstash.generated.CompiledDataset2.compute(Unknown Source)", "org.logstash.generated.CompiledDataset3.compute(Unknown Source)", "org.logstash.generated.CompiledDataset2.compute(Unknown Source)", "org.logstash.generated.CompiledDataset3.compute(Unknown Source)", "org.logstash.generated.CompiledDataset2.compute(Unknown Source)", "org.logstash.generated.CompiledDataset3.compute(Unknown Source)", "org.logstash.generated.CompiledDataset2.compute(Unknown Source)", "org.logstash.generated.CompiledDataset3.compute(Unknown Source)", "org.logstash.generated.CompiledDataset2.compute(Unknown Source)", "org.logstash.generated.CompiledDataset3.compute(Unknown Source)", "org.logstash.generated.CompiledDataset2.compute(Unknown Source)", "org.logstash.generated.CompiledDataset6.compute(Unknown Source)", "org.logstash.generated.CompiledDataset3.compute(Unknown Source)", "org.logstash.generated.CompiledDataset2.compute(Unknown Source)", "org.logstash.generated.CompiledDataset4.compute(Unknown Source)", "org.logstash.generated.CompiledDataset2.compute(Unknown Source)", "org.logstash.generated.CompiledDataset5.compute(Unknown Source)", "org.logstash.generated.CompiledDataset2.compute(Unknown Source)", "org.logstash.generated.CompiledDataset2.compute(Unknown Source)", "org.logstash.generated.CompiledDataset3.compute(Unknown Source)", "org.logstash.generated.CompiledDataset4.compute(Unknown Source)", "org.logstash.generated.CompiledDataset2.compute(Unknown Source)", "org.logstash.generated.CompiledDataset4.compute(Unknown Source)", "org.logstash.generated.CompiledDataset2.compute(Unknown Source)", "org.logstash.generated.CompiledDataset2.compute(Unknown Source)", "org.logstash.generated.CompiledDataset5.compute(Unknown Source)", "org.logstash.generated.CompiledDataset2.compute(Unknown Source)", "org.logstash.generated.CompiledDataset4.compute(Unknown Source)", "org.logstash.generated.CompiledDataset2.compute(Unknown Source)", "org.logstash.generated.CompiledDataset2.compute(Unknown Source)", "org.logstash.generated.CompiledDataset7.compute(Unknown Source)", "org.logstash.generated.CompiledDataset4.compute(Unknown Source)", "org.logstash.generated.CompiledDataset2.compute(Unknown Source)", "org.logstash.generated.CompiledDataset4.compute(Unknown Source)", "org.logstash.generated.CompiledDataset2.compute(Unknown Source)", "org.logstash.generated.CompiledDataset2.compute(Unknown Source)", "org.logstash.generated.CompiledDataset7.compute(Unknown Source)", "org.logstash.generated.CompiledDataset4.compute(Unknown Source)", "org.logstash.generated.CompiledDataset2.compute(Unknown Source)", "org.logstash.generated.CompiledDataset2.compute(Unknown Source)", "org.logstash.generated.CompiledDataset5.compute(Unknown Source)", "org.logstash.generated.CompiledDataset4.compute(Unknown Source)", "org.logstash.generated.CompiledDataset2.compute(Unknown Source)", "org.logstash.generated.CompiledDataset3.compute(Unknown Source)", "org.logstash.generated.CompiledDataset2.compute(Unknown Source)", "org.logstash.generated.CompiledDataset8.compute(Unknown Source)", "org.logstash.config.ir.CompiledPipeline$CompiledUnorderedExecution.compute(CompiledPipeline.java:329)", "org.logstash.config.ir.CompiledPipeline$CompiledUnorderedExecution.compute(CompiledPipeline.java:323)", "org.logstash.execution.WorkerLoop.run(WorkerLoop.java:83)", "java.base/jdk.internal.reflect.NativeMethodAccessorImpl.invoke0(Native Method)", "java.base/jdk.internal.reflect.NativeMethodAccessorImpl.invoke(NativeMethodAccessorImpl.java:62)", "java.base/jdk.internal.reflect.DelegatingMethodAccessorImpl.invoke(DelegatingMethodAccessorImpl.java:43)", "java.base/java.lang.reflect.Method.invoke(Method.java:566)", "org.jruby.javasupport.JavaMethod.invokeDirectWithExceptionHandling(JavaMethod.java:441)", "org.jruby.javasupport.JavaMethod.invokeDirect(JavaMethod.java:305)", "org.jruby.java.invokers.InstanceMethodInvoker.call(InstanceMethodInvoker.java:32)", "usr.share.logstash.logstash_minus_core.lib.logstash.java_pipeline.RUBY$block$start_workers$5(/usr/share/logstash/logstash-core/lib/logstash/java_pipeline.rb:295)", "org.jruby.runtime.CompiledIRBlockBody.callDirect(CompiledIRBlockBody.java:138)", "org.jruby.runtime.IRBlockBody.call(IRBlockBody.java:58)", "org.jruby.runtime.IRBlockBody.call(IRBlockBody.java:52)", "org.jruby.runtime.Block.call(Block.java:139)", "org.jruby.RubyProc.call(RubyProc.java:318)", "org.jruby.internal.runtime.RubyRunnable.run(RubyRunnable.java:105)", "java.base/java.lang.Thread.run(Thread.java:834)"], :class=>"Java::OrgLogstash::Accessors::InvalidFieldSetException"}

 - Kibana logs (`journalctl -u kibana.service`)
-- Logs begin at Sun 2020-12-20 00:10:39 AEDT, end at Sun 2020-12-20 08:33:13 AEDT. --
Dec 20 00:43:48 elk3 systemd[1]: Started Kibana.
Dec 20 00:43:52 elk3 systemd[1]: Stopping Kibana...
Dec 20 00:43:53 elk3 kibana[5680]: {"type":"log","@timestamp":"2020-12-19T13:43:53Z","tags":["info","plugins-service"],"pid":5680,"message":"Plugin \"auditTrail\" is disabled."}
Dec 20 00:43:53 elk3 kibana[5680]: {"type":"log","@timestamp":"2020-12-19T13:43:53Z","tags":["info","plugins-service"],"pid":5680,"message":"Plugin \"visTypeXy\" is disabled."}
Dec 20 00:43:53 elk3 kibana[5680]: {"type":"log","@timestamp":"2020-12-19T13:43:53Z","tags":["warning","config","deprecation"],"pid":5680,"message":"Config key [monitoring.cluster_alerts.email_notifications.email
Dec 20 00:43:53 elk3 systemd[1]: Stopped Kibana.
Dec 20 00:43:53 elk3 systemd[1]: Started Kibana.
Dec 20 00:43:58 elk3 kibana[5698]: {"type":"log","@timestamp":"2020-12-19T13:43:58Z","tags":["info","plugins-service"],"pid":5698,"message":"Plugin \"visTypeXy\" is disabled."}
Dec 20 00:43:58 elk3 kibana[5698]: {"type":"log","@timestamp":"2020-12-19T13:43:58Z","tags":["info","plugins-service"],"pid":5698,"message":"Plugin \"auditTrail\" is disabled."}
Dec 20 00:43:58 elk3 kibana[5698]: {"type":"log","@timestamp":"2020-12-19T13:43:58Z","tags":["warning","config","deprecation"],"pid":5698,"message":"Config key [monitoring.cluster_alerts.email_notifications.email
Dec 20 00:43:58 elk3 kibana[5698]: {"type":"log","@timestamp":"2020-12-19T13:43:58Z","tags":["info","plugins-system"],"pid":5698,"message":"Setting up [96] plugins: [taskManager,licensing,globalSearch,globalSearc
Dec 20 00:43:58 elk3 kibana[5698]: {"type":"log","@timestamp":"2020-12-19T13:43:58Z","tags":["warning","plugins","security","config"],"pid":5698,"message":"Generating a random key for xpack.security.encryptionKey
Dec 20 00:43:58 elk3 kibana[5698]: {"type":"log","@timestamp":"2020-12-19T13:43:58Z","tags":["warning","plugins","security","config"],"pid":5698,"message":"Session cookies will be transmitted over insecure connec
Dec 20 00:43:58 elk3 kibana[5698]: {"type":"log","@timestamp":"2020-12-19T13:43:58Z","tags":["warning","plugins","encryptedSavedObjects","config"],"pid":5698,"message":"Generating a random key for xpack.encrypted
Dec 20 00:43:58 elk3 kibana[5698]: {"type":"log","@timestamp":"2020-12-19T13:43:58Z","tags":["warning","plugins","ingestManager"],"pid":5698,"message":"Fleet APIs are disabled due to the Encrypted Saved Objects p
Dec 20 00:43:59 elk3 kibana[5698]: {"type":"log","@timestamp":"2020-12-19T13:43:59Z","tags":["warning","plugins","reporting","config"],"pid":5698,"message":"Generating a random key for xpack.reporting.encryptionK
Dec 20 00:43:59 elk3 kibana[5698]: {"type":"log","@timestamp":"2020-12-19T13:43:59Z","tags":["info","plugins","reporting","config"],"pid":5698,"message":"Chromium sandbox provides an additional layer of protectio
Dec 20 00:43:59 elk3 kibana[5698]: {"type":"log","@timestamp":"2020-12-19T13:43:59Z","tags":["warning","plugins","actions","actions"],"pid":5698,"message":"APIs are disabled due to the Encrypted Saved Objects plu
Dec 20 00:43:59 elk3 kibana[5698]: {"type":"log","@timestamp":"2020-12-19T13:43:59Z","tags":["warning","plugins","alerts","plugins","alerting"],"pid":5698,"message":"APIs are disabled due to the Encrypted Saved O
Dec 20 00:43:59 elk3 kibana[5698]: {"type":"log","@timestamp":"2020-12-19T13:43:59Z","tags":["info","plugins","monitoring","monitoring"],"pid":5698,"message":"config sourced from: production cluster"}
Dec 20 00:43:59 elk3 kibana[5698]: {"type":"log","@timestamp":"2020-12-19T13:43:59Z","tags":["info","savedobjects-service"],"pid":5698,"message":"Waiting until all Elasticsearch nodes are compatible with Kibana b
Dec 20 00:43:59 elk3 kibana[5698]: {"type":"log","@timestamp":"2020-12-19T13:43:59Z","tags":["info","savedobjects-service"],"pid":5698,"message":"Starting saved objects migrations"}
Dec 20 00:43:59 elk3 kibana[5698]: {"type":"log","@timestamp":"2020-12-19T13:43:59Z","tags":["info","savedobjects-service"],"pid":5698,"message":"Creating index .kibana_task_manager_1."}
Dec 20 00:43:59 elk3 kibana[5698]: {"type":"log","@timestamp":"2020-12-19T13:43:59Z","tags":["info","savedobjects-service"],"pid":5698,"message":"Creating index .kibana_1."}
Dec 20 00:43:59 elk3 kibana[5698]: {"type":"log","@timestamp":"2020-12-19T13:43:59Z","tags":["info","savedobjects-service"],"pid":5698,"message":"Pointing alias .kibana_task_manager to .kibana_task_manager_1."}
Dec 20 00:43:59 elk3 kibana[5698]: {"type":"log","@timestamp":"2020-12-19T13:43:59Z","tags":["info","savedobjects-service"],"pid":5698,"message":"Pointing alias .kibana to .kibana_1."}
Dec 20 00:43:59 elk3 kibana[5698]: {"type":"log","@timestamp":"2020-12-19T13:43:59Z","tags":["info","savedobjects-service"],"pid":5698,"message":"Finished in 176ms."}
Dec 20 00:43:59 elk3 kibana[5698]: {"type":"log","@timestamp":"2020-12-19T13:43:59Z","tags":["info","savedobjects-service"],"pid":5698,"message":"Finished in 185ms."}
Dec 20 00:43:59 elk3 kibana[5698]: {"type":"log","@timestamp":"2020-12-19T13:43:59Z","tags":["info","plugins-system"],"pid":5698,"message":"Starting [96] plugins: [taskManager,licensing,globalSearch,globalSearchP
Dec 20 00:43:59 elk3 kibana[5698]: {"type":"log","@timestamp":"2020-12-19T13:43:59Z","tags":["info","plugins","taskManager","taskManager"],"pid":5698,"message":"TaskManager is identified by the Kibana UUID: d8e2f
Dec 20 00:43:59 elk3 kibana[5698]: {"type":"log","@timestamp":"2020-12-19T13:43:59Z","tags":["info","plugins","crossClusterReplication"],"pid":5698,"message":"Your basic license does not support crossClusterRepli
Dec 20 00:43:59 elk3 kibana[5698]: {"type":"log","@timestamp":"2020-12-19T13:43:59Z","tags":["info","plugins","watcher"],"pid":5698,"message":"Your basic license does not support watcher. Please upgrade your lice
Dec 20 00:43:59 elk3 kibana[5698]: {"type":"log","@timestamp":"2020-12-19T13:43:59Z","tags":["info","plugins","monitoring","monitoring","kibana-monitoring"],"pid":5698,"message":"Starting monitoring stats collect
Dec 20 00:44:00 elk3 kibana[5698]: {"type":"log","@timestamp":"2020-12-19T13:44:00Z","tags":["listening","info"],"pid":5698,"message":"Server running at http://0.0.0.0:5601"}
Dec 20 00:44:00 elk3 kibana[5698]: {"type":"log","@timestamp":"2020-12-19T13:44:00Z","tags":["info","http","server","Kibana"],"pid":5698,"message":"http server running at http://0.0.0.0:5601"}
Dec 20 00:46:59 elk3 kibana[5698]: {"type":"response","@timestamp":"2020-12-19T13:46:59Z","tags":[],"pid":5698,"method":"get","statusCode":302,"req":{"url":"/","method":"get","headers":{"host":"192.168.69.212:560
Dec 20 00:46:59 elk3 kibana[5698]: {"type":"response","@timestamp":"2020-12-19T13:46:59Z","tags":[],"pid":5698,"method":"get","statusCode":302,"req":{"url":"/spaces/enter","method":"get","headers":{"host":"192.16
Dec 20 00:46:59 elk3 kibana[5698]: {"type":"response","@timestamp":"2020-12-19T13:46:59Z","tags":[],"pid":5698,"method":"get","statusCode":200,"req":{"url":"/app/home","method":"get","headers":{"host":"192.168.69
Dec 20 00:46:59 elk3 kibana[5698]: {"type":"response","@timestamp":"2020-12-19T13:46:59Z","tags":["api"],"pid":5698,"method":"get","statusCode":200,"req":{"url":"/bootstrap.js","method":"get","headers":{"host":"1
Dec 20 00:46:59 elk3 kibana[5698]: {"type":"response","@timestamp":"2020-12-19T13:46:59Z","tags":[],"pid":5698,"method":"get","statusCode":200,"req":{"url":"/35949/bundles/plugin/licensing/licensing.plugin.js","m
Dec 20 00:46:59 elk3 kibana[5698]: {"type":"response","@timestamp":"2020-12-19T13:46:59Z","tags":[],"pid":5698,"method":"get","statusCode":200,"req":{"url":"/35949/bundles/plugin/kibanaReact/kibanaReact.plugin.js
Dec 20 00:46:59 elk3 kibana[5698]: {"type":"response","@timestamp":"2020-12-19T13:46:59Z","tags":[],"pid":5698,"method":"get","statusCode":200,"req":{"url":"/35949/bundles/plugin/kibanaUtils/kibanaUtils.plugin.js
Dec 20 00:46:59 elk3 kibana[5698]: {"type":"response","@timestamp":"2020-12-19T13:46:59Z","tags":[],"pid":5698,"method":"get","statusCode":200,"req":{"url":"/35949/bundles/core/core.entry.js","method":"get","head
Dec 20 00:46:59 elk3 kibana[5698]: {"type":"response","@timestamp":"2020-12-19T13:46:59Z","tags":[],"pid":5698,"method":"get","statusCode":200,"req":{"url":"/35949/bundles/plugin/globalSearch/globalSearch.plugin.
Dec 20 00:46:59 elk3 kibana[5698]: {"type":"response","@timestamp":"2020-12-19T13:46:59Z","tags":[],"pid":5698,"method":"get","statusCode":200,"req":{"url":"/35949/bundles/kbn-ui-shared-deps/kbn-ui-shared-deps.@e
Dec 20 00:46:59 elk3 kibana[5698]: {"type":"response","@timestamp":"2020-12-19T13:46:59Z","tags":[],"pid":5698,"method":"get","statusCode":200,"req":{"url":"/35949/bundles/plugin/globalSearchProviders/globalSearc
Dec 20 00:46:59 elk3 kibana[5698]: {"type":"response","@timestamp":"2020-12-19T13:46:59Z","tags":[],"pid":5698,"method":"get","statusCode":200,"req":{"url":"/35949/bundles/plugin/usageCollection/usageCollection.p
Dec 20 00:46:59 elk3 kibana[5698]: {"type":"response","@timestamp":"2020-12-19T13:46:59Z","tags":[],"pid":5698,"method":"get","statusCode":200,"req":{"url":"/35949/bundles/plugin/globalSearchBar/globalSearchBar.p
Dec 20 00:46:59 elk3 kibana[5698]: {"type":"response","@timestamp":"2020-12-19T13:46:59Z","tags":[],"pid":5698,"method":"get","statusCode":200,"req":{"url":"/35949/bundles/plugin/telemetry/telemetry.plugin.js","m
Dec 20 00:46:59 elk3 kibana[5698]: {"type":"response","@timestamp":"2020-12-19T13:46:59Z","tags":[],"pid":5698,"method":"get","statusCode":200,"req":{"url":"/35949/bundles/plugin/securityOss/securityOss.plugin.js
Dec 20 00:46:59 elk3 kibana[5698]: {"type":"response","@timestamp":"2020-12-19T13:46:59Z","tags":[],"pid":5698,"method":"get","statusCode":200,"req":{"url":"/35949/bundles/plugin/newsfeed/newsfeed.plugin.js","met
Dec 20 00:46:59 elk3 kibana[5698]: {"type":"response","@timestamp":"2020-12-19T13:46:59Z","tags":[],"pid":5698,"method":"get","statusCode":200,"req":{"url":"/35949/bundles/kbn-ui-shared-deps/kbn-ui-shared-deps.js
Dec 20 00:46:59 elk3 kibana[5698]: {"type":"response","@timestamp":"2020-12-19T13:46:59Z","tags":[],"pid":5698,"method":"get","statusCode":200,"req":{"url":"/35949/bundles/plugin/mapsLegacy/mapsLegacy.plugin.js",
Dec 20 00:46:59 elk3 kibana[5698]: {"type":"response","@timestamp":"2020-12-19T13:46:59Z","tags":[],"pid":5698,"method":"get","statusCode":200,"req":{"url":"/35949/bundles/plugin/charts/charts.plugin.js","method"
Dec 20 00:46:59 elk3 kibana[5698]: {"type":"response","@timestamp":"2020-12-19T13:46:59Z","tags":[],"pid":5698,"method":"get","statusCode":200,"req":{"url":"/35949/bundles/plugin/visDefaultEditor/visDefaultEditor
Dec 20 00:46:59 elk3 kibana[5698]: {"type":"response","@timestamp":"2020-12-19T13:46:59Z","tags":[],"pid":5698,"method":"get","statusCode":200,"req":{"url":"/35949/bundles/plugin/inspector/inspector.plugin.js","m
Dec 20 00:46:59 elk3 kibana[5698]: {"type":"response","@timestamp":"2020-12-19T13:46:59Z","tags":[],"pid":5698,"method":"get","statusCode":200,"req":{"url":"/35949/bundles/plugin/mapsLegacyLicensing/mapsLegacyLic
Dec 20 00:46:59 elk3 kibana[5698]: {"type":"response","@timestamp":"2020-12-19T13:46:59Z","tags":[],"pid":5698,"method":"get","statusCode":200,"req":{"url":"/35949/bundles/plugin/data/data.plugin.js","method":"ge
Dec 20 00:46:59 elk3 kibana[5698]: {"type":"response","@timestamp":"2020-12-19T13:46:59Z","tags":[],"pid":5698,"method":"get","statusCode":200,"req":{"url":"/35949/bundles/plugin/kibanaLegacy/kibanaLegacy.plugin.
Dec 20 00:46:59 elk3 kibana[5698]: {"type":"response","@timestamp":"2020-12-19T13:46:59Z","tags":[],"pid":5698,"method":"get","statusCode":200,"req":{"url":"/35949/bundles/plugin/urlForwarding/urlForwarding.plugi
Dec 20 00:46:59 elk3 kibana[5698]: {"type":"response","@timestamp":"2020-12-19T13:46:59Z","tags":[],"pid":5698,"method":"get","statusCode":200,"req":{"url":"/35949/bundles/plugin/devTools/devTools.plugin.js","met
Dec 20 00:46:59 elk3 kibana[5698]: {"type":"response","@timestamp":"2020-12-19T13:46:59Z","tags":[],"pid":5698,"method":"get","statusCode":200,"req":{"url":"/35949/bundles/plugin/uiActions/uiActions.plugin.js","m
Dec 20 00:46:59 elk3 kibana[5698]: {"type":"response","@timestamp":"2020-12-19T13:46:59Z","tags":[],"pid":5698,"method":"get","statusCode":200,"req":{"url":"/35949/bundles/plugin/share/share.plugin.js","method":"
Dec 20 00:46:59 elk3 kibana[5698]: {"type":"response","@timestamp":"2020-12-19T13:46:59Z","tags":[],"pid":5698,"method":"get","statusCode":200,"req":{"url":"/35949/bundles/plugin/embeddable/embeddable.plugin.js",
Dec 20 00:46:59 elk3 kibana[5698]: {"type":"response","@timestamp":"2020-12-19T13:46:59Z","tags":[],"pid":5698,"method":"get","statusCode":200,"req":{"url":"/35949/bundles/plugin/savedObjects/savedObjects.plugin.
Dec 20 00:46:59 elk3 kibana[5698]: {"type":"response","@timestamp":"2020-12-19T13:46:59Z","tags":[],"pid":5698,"method":"get","statusCode":200,"req":{"url":"/35949/bundles/plugin/urlDrilldown/urlDrilldown.plugin.
Dec 20 00:46:59 elk3 kibana[5698]: {"type":"response","@timestamp":"2020-12-19T13:46:59Z","tags":[],"pid":5698,"method":"get","statusCode":200,"req":{"url":"/35949/bundles/plugin/uiActionsEnhanced/uiActionsEnhanc
Dec 20 00:46:59 elk3 kibana[5698]: {"type":"response","@timestamp":"2020-12-19T13:46:59Z","tags":[],"pid":5698,"method":"get","statusCode":200,"req":{"url":"/35949/bundles/plugin/embeddableEnhanced/embeddableEnha
Dec 20 00:46:59 elk3 kibana[5698]: {"type":"response","@timestamp":"2020-12-19T13:46:59Z","tags":[],"pid":5698,"method":"get","statusCode":200,"req":{"url":"/35949/bundles/plugin/bfetch/bfetch.plugin.js","method"
Dec 20 00:46:59 elk3 kibana[5698]: {"type":"response","@timestamp":"2020-12-19T13:46:59Z","tags":[],"pid":5698,"method":"get","statusCode":200,"req":{"url":"/35949/bundles/plugin/home/home.plugin.js","method":"ge
Dec 20 00:46:59 elk3 kibana[5698]: {"type":"response","@timestamp":"2020-12-19T13:46:59Z","tags":[],"pid":5698,"method":"get","statusCode":200,"req":{"url":"/35949/bundles/plugin/expressions/expressions.plugin.js
Dec 20 00:46:59 elk3 kibana[5698]: {"type":"response","@timestamp":"2020-12-19T13:46:59Z","tags":[],"pid":5698,"method":"get","statusCode":200,"req":{"url":"/35949/bundles/plugin/apmOss/apmOss.plugin.js","method"
Dec 20 00:46:59 elk3 kibana[5698]: {"type":"response","@timestamp":"2020-12-19T13:46:59Z","tags":[],"pid":5698,"method":"get","statusCode":200,"req":{"url":"/35949/bundles/plugin/observability/observability.plugi
Dec 20 00:46:59 elk3 kibana[5698]: {"type":"response","@timestamp":"2020-12-19T13:46:59Z","tags":[],"pid":5698,"method":"get","statusCode":200,"req":{"url":"/35949/bundles/plugin/cloud/cloud.plugin.js","method":"
Dec 20 00:46:59 elk3 kibana[5698]: {"type":"response","@timestamp":"2020-12-19T13:46:59Z","tags":[],"pid":5698,"method":"get","statusCode":200,"req":{"url":"/35949/bundles/plugin/console/console.plugin.js","metho
Dec 20 00:46:59 elk3 kibana[5698]: {"type":"response","@timestamp":"2020-12-19T13:46:59Z","tags":[],"pid":5698,"method":"get","statusCode":200,"req":{"url":"/35949/bundles/plugin/painlessLab/painlessLab.plugin.js
Dec 20 00:46:59 elk3 kibana[5698]: {"type":"response","@timestamp":"2020-12-19T13:46:59Z","tags":[],"pid":5698,"method":"get","statusCode":200,"req":{"url":"/35949/bundles/plugin/searchprofiler/searchprofiler.plu
Dec 20 00:46:59 elk3 kibana[5698]: {"type":"response","@timestamp":"2020-12-19T13:46:59Z","tags":[],"pid":5698,"method":"get","statusCode":200,"req":{"url":"/35949/bundles/plugin/grokdebugger/grokdebugger.plugin.
Dec 20 00:46:59 elk3 kibana[5698]: {"type":"response","@timestamp":"2020-12-19T13:46:59Z","tags":[],"pid":5698,"method":"get","statusCode":200,"req":{"url":"/35949/bundles/plugin/esUiShared/esUiShared.plugin.js",
Dec 20 00:46:59 elk3 kibana[5698]: {"type":"response","@timestamp":"2020-12-19T13:46:59Z","tags":[],"pid":5698,"method":"get","statusCode":200,"req":{"url":"/35949/bundles/plugin/management/management.plugin.js",
Dec 20 00:46:59 elk3 kibana[5698]: {"type":"response","@timestamp":"2020-12-19T13:46:59Z","tags":[],"pid":5698,"method":"get","statusCode":200,"req":{"url":"/35949/bundles/plugin/advancedSettings/advancedSettings
Dec 20 00:46:59 elk3 kibana[5698]: {"type":"response","@timestamp":"2020-12-19T13:46:59Z","tags":[],"pid":5698,"method":"get","statusCode":200,"req":{"url":"/35949/bundles/plugin/indexPatternManagement/indexPatte
Dec 20 00:46:59 elk3 kibana[5698]: {"type":"response","@timestamp":"2020-12-19T13:46:59Z","tags":[],"pid":5698,"method":"get","statusCode":200,"req":{"url":"/35949/bundles/plugin/telemetryManagementSection/teleme

**Additional context**
N/A

**Attach the pfELK Error Log (error.pfelk), for Better Assistance***
 - Do not copy/paste log; attach as a file
[error.pfelk.log](https://github.com/pfelk/pfelk/files/5720192/error.pfelk.log)

**Comment by a3ilson** [comment]
@spidershark45 - Unable to replicate error.  I installed a fresh instance (in addition to the one I did in #223) and had no issues getting everything up and running.  

However and unlike #223, the provided log contained logstash errors. 

Please confirm the following:
- [ ] Where the [finalization](https://github.com/pfelk/pfelk/blob/master/install/configuration.md) steps accomplished, specifically step 2
- [ ] Where the logs from pfSense sent to pfELK before or after accomplishing step 2 [finalization](https://github.com/pfelk/pfelk/blob/master/install/configuration.md)


Finally, lets unravel the error in your  provided log
```
Dec 20 08:16:03 elk3 logstash[655]: [2020-12-20T08:16:03,753][WARN ][logstash.filters.grok    ][main][6febadf1e5a886f4ce05c3eb02829c20383eda2b0f48aa3fa9240a39420d86d9] Grok regexp threw exception {:exception=>"Could not set field 'action' on object '/index.php' to value ' Successful login'.This is probably due to trying to set a field like [foo][bar] = someValuewhen [foo] is not either a map or a string", :backtrace=>["org.logstash.Accessors.setChild(Accessors.java:142)",...
```
- Please attach the logstash log file `/var/log/logstash/logstash-plain.log`
- Please try restarting logstash `systemctl restart logstash.service` 
  - After it restarts recheck Kibana and see if the dashboards are populated 
- Navigate to Kibana/Discover and provide a screenshot

**Comment by spidershark45** [comment]
Hey @a3ilson,

Confirming that the finalization steps were completed, these were done prior to putting the IP address in pfSense (this was done last).

I've attached the logstash-plain.log
[logstash-plain.log](https://github.com/pfelk/pfelk/files/5720564/logstash-plain.log)

Confirmed I've done the systemctl restart logstash.service
- checked Kibana dashboards after - still nothing displayed in there.

Screenshots from Kibana/Discover below (for pfelk-firewall)
https://imgur.com/v4x9Yth
https://imgur.com/EB4r6NQ

The error message from the "search error - bad request" popup is

search_phase_execution_exception
all shards failed

Wrapper@http://192.168.69.212:5601/35949/bundles/core/core.entry.js:6:4249
_createSuperInternal@http://192.168.69.212:5601/35949/bundles/core/core.entry.js:6:3388
HttpFetchError@http://192.168.69.212:5601/35949/bundles/core/core.entry.js:6:6016
_callee3$@http://192.168.69.212:5601/35949/bundles/core/core.entry.js:6:59535
l@http://192.168.69.212:5601/35949/bundles/kbn-ui-shared-deps/kbn-ui-shared-deps.js:380:1740519
s/o._invoke</<@http://192.168.69.212:5601/35949/bundles/kbn-ui-shared-deps/kbn-ui-shared-deps.js:380:1740273
_/</e[t]@http://192.168.69.212:5601/35949/bundles/kbn-ui-shared-deps/kbn-ui-shared-deps.js:380:1740876
fetch_asyncGeneratorStep@http://192.168.69.212:5601/35949/bundles/core/core.entry.js:6:52652
_next@http://192.168.69.212:5601/35949/bundles/core/core.entry.js:6:52992

Thanks for your help!

**Comment by a3ilson** [comment]
@spidershark45 - Thanks!

Your setup and configuration are good - no need to reinstall.  However, it appears the received log syntax is resulting in errors and once corrected should resolve the issue.

### Here's what I'm seeing as problematic (errors):
1. The data is not being index (let's confirm)


2. There is a GROK value that is causing an issue 
```
[2020-12-20T08:16:03,753][WARN ][logstash.filters.grok    ][main][6febadf1e5a886f4ce05c3eb02829c20383eda2b0f48aa3fa9240a39420d86d9] Grok regexp threw exception {:exception=>"Could not set field 'action' on object '/index.php' to value ' Successful login'.This is probably due to trying to set a field like [foo][bar] = someValuewhen [foo] is not either a map or a string", :backtrace=>["org.logstash.Accessors.setChild(Accessors.java:142)", "org.logstash.Accessors.set(Accessors.java:36)", "org.logstash.Event.setField(Event.java:208)", "org.logstash.ext.JrubyEventExtLibrary$RubyEvent.ruby_set_field(JrubyEventExtLibrary.java:121)", "usr.share.logstash.vendor.bundle.jruby.
```


### To expand on both those can you provide the following:
1. Run the following command and provide the output (provide a sample of 20-50 logs)
  - `sudo tcpdump -vvv -A -i any port 5140`

2. Within Kibana, navigate to: Management>>Stack Management>>Data>>Index Management 
 - e.g. ![Screen Shot 2020-12-20 at 09 30 31](https://user-images.githubusercontent.com/16884679/102715853-0c1a8100-42a6-11eb-94a2-af38ccfe1112.png)
 - Check and see what the Docs Count and Storage Size depict

**Comment by spidershark45** [comment]
Hey @a3ilson,

tcpdump looks like traffic is coming in on 5140, I saw suricata and firewall logs in there (no DHCP, but that might have been because there was no activity when I was running the dump).

I've done some redaction on the below.

tcpdump: listening on any, link-type LINUX_SLL (Linux cooked), capture size 262144 bytes
09:57:12.702979 IP (tos 0x0, ttl 64, id 23358, offset 0, flags [none], proto UDP (17), length 190)
    _gateway.syslog > elk3.5140: [udp sum ok] SYSLOG, length: 162
        Facility local0 (16), Severity info (6)
        Msg: Dec 21 09:57:12 filterlog: 5,,,1000000103,igb0,match,block,in,4,0x0,,238,55851,0,none,6,tcp,40,92.63.196.125,xxx.xxx.xxx.xxx,58329,14112,0,S,3426744830,,1024,,
<HEX REMOVED>

E...[>..@.....E...E........*<134>Dec 21 09:57:12 filterlog: 5,,,1000000103,igb0,match,block,in,4,0x0,,238,55851,0,none,6,tcp,40,92.63.196.125,xxx.xxx.xxx.xxx,58329,14112,0,S,3426744830,,1024,,
09:57:16.757421 IP (tos 0x0, ttl 64, id 45515, offset 0, flags [none], proto UDP (17), length 171)
    _gateway.syslog > elk3.5140: [udp sum ok] SYSLOG, length: 143
        Facility local0 (16), Severity info (6)
        Msg: Dec 21 09:57:16 filterlog: 7,,,1000000105,igb1,match,block,in,6,0x00,0x79899,255,UDP,17,53,fe80::954f:2c89:ef87:a01e,ff02::fb,5353,5353,53
<HEX REMOVED>

E.......@..P..E...E........]<134>Dec 21 09:57:16 filterlog: 7,,,1000000105,igb1,match,block,in,6,0x00,0x79899,255,UDP,17,53,fe80::954f:2c89:ef87:a01e,ff02::fb,5353,5353,53
09:57:16.757461 IP (tos 0x0, ttl 64, id 42296, offset 0, flags [none], proto UDP (17), length 188)
    _gateway.syslog > elk3.5140: [udp sum ok] SYSLOG, length: 160
        Facility local0 (16), Severity info (6)
        Msg: Dec 21 09:57:16 filterlog: 5,,,1000000103,igb0,match,block,in,4,0x0,,229,2706,0,none,6,tcp,40,91.211.88.110,xxx.xxx.xxx.xxx,53569,8432,0,S,3938926231,,1024,,
<HEX REMOVED>

E....8..@.....E...E.........<134>Dec 21 09:57:16 filterlog: 5,,,1000000103,igb0,match,block,in,4,0x0,,229,2706,0,none,6,tcp,40,91.211.88.110,xxx.xxx.xxx.xxx,53569,8432,0,S,3938926231,,1024,,
09:57:17.759055 IP (tos 0x0, ttl 64, id 49852, offset 0, flags [none], proto UDP (17), length 214)
    _gateway.syslog > elk3.5140: [udp sum ok] SYSLOG, length: 186
        Facility local0 (16), Severity info (6)
        Msg: Dec 21 09:57:17 filterlog: 99,,,1000006961,igb0,match,pass,out,4,0x0,,127,35759,0,DF,6,tcp,52,xxx.xxx.xxx.xxx,13.107.136.9,4958,443,0,S,455488666,,64240,,mss;nop;wscale;nop;nop;sackOK
<HEX REMOVED>

E.......@..4..E...E.........<134>Dec 21 09:57:17 filterlog: 99,,,1000006961,igb0,match,pass,out,4,0x0,,127,35759,0,DF,6,tcp,52,xxx.xxx.xxx.xxx,13.107.136.9,4958,443,0,S,455488666,,64240,,mss;nop;wscale;nop;nop;sackOK
09:57:18.100939 IP (tos 0x0, ttl 64, id 61384, offset 0, flags [none], proto UDP (17), length 508)
    _gateway.syslog > elk3.5140: [udp sum ok] SYSLOG, length: 480
        Facility local1 (17), Severity notice (5)
        Msg: Dec 21 09:57:18 suricata[1529]: {"timestamp": "2020-12-21T09:57:17.774819+1100", "flow_id": 1722264014647978, "in_iface": "igb1", "event_type": "tls", "src_ip": "192.168.69.44", "src_port": 53601, "dest_ip": "13.107.136.9", "dest_port": 443, "proto": "TCP", "tls": {"subject": "C=US, ST=Washington, L=Redmond, O=Microsoft Corporation, CN=*.sharepoint.com", "issuerdn": "C=US, O=DigiCert Inc, CN=DigiCert Cloud Services CA-1", "serial": "04:27:DB:83:E1:32:36:3C:0C:01:16:CE:FC
<HEX REMOVED>

E.......@.}...E...E........J<141>Dec 21 09:57:18 suricata[1529]: {"timestamp": "2020-12-21T09:57:17.774819+1100", "flow_id": 1722264014647978, "in_iface": "igb1", "event_type": "tls", "src_ip": "192.168.69.44", "src_port": 53601, "dest_ip": "13.107.136.9", "dest_port": 443, "proto": "TCP", "tls": {"subject": "C=US, ST=Washington, L=Redmond, O=Microsoft Corporation, CN=*.sharepoint.com", "issuerdn": "C=US, O=DigiCert Inc, CN=DigiCert Cloud Services CA-1", "serial": "04:27:DB:83:E1:32:36:3C:0C:01:16:CE:FC
09:57:18.769262 IP (tos 0x0, ttl 64, id 24149, offset 0, flags [none], proto UDP (17), length 189)
    _gateway.syslog > elk3.5140: [udp sum ok] SYSLOG, length: 161
        Facility local0 (16), Severity info (6)
        Msg: Dec 21 09:57:18 filterlog: 5,,,1000000103,igb0,match,block,in,4,0x0,,229,49710,0,none,6,tcp,40,91.211.88.110,xxx.xxx.xxx.xxx,53569,19181,0,S,491756598,,1024,,
<HEX REMOVED>

E...^U..@.....E...E........H<134>Dec 21 09:57:18 filterlog: 5,,,1000000103,igb0,match,block,in,4,0x0,,229,49710,0,none,6,tcp,40,91.211.88.110,xxx.xxx.xxx.xxx,53569,19181,0,S,491756598,,1024,,
09:57:19.813507 IP (tos 0x0, ttl 64, id 36011, offset 0, flags [none], proto UDP (17), length 210)
    _gateway.syslog > elk3.5140: [udp sum ok] SYSLOG, length: 182
        Facility local0 (16), Severity info (6)
        Msg: Dec 21 09:57:19 filterlog: 99,,,1000006961,igb0,match,pass,out,4,0x0,,63,12180,0,DF,6,tcp,60,xxx.xxx.xxx.xxx,142.250.66.228,25153,80,0,S,966081558,,29200,,mss;sackOK;TS;nop;wscale
<HEX REMOVED>

E.......@..I..E...E.........<134>Dec 21 09:57:19 filterlog: 99,,,1000006961,igb0,match,pass,out,4,0x0,,63,12180,0,DF,6,tcp,60,xxx.xxx.xxx.xxx,142.250.66.228,25153,80,0,S,966081558,,29200,,mss;sackOK;TS;nop;wscale
09:57:19.813543 IP (tos 0x0, ttl 64, id 14960, offset 0, flags [none], proto UDP (17), length 208)
    _gateway.syslog > elk3.5140: [udp sum ok] SYSLOG, length: 180
        Facility local0 (16), Severity info (6)
        Msg: Dec 21 09:57:19 filterlog: 99,,,1000006961,igb0,match,pass,out,4,0x0,,63,6845,0,DF,6,tcp,60,xxx.xxx.xxx.xxx,142.250.67.3,45274,80,0,S,2231896383,,29200,,mss;sackOK;TS;nop;wscale
<HEX REMOVED>

E...:p..@.3...E...E........C<134>Dec 21 09:57:19 filterlog: 99,,,1000006961,igb0,match,pass,out,4,0x0,,63,6845,0,DF,6,tcp,60,xxx.xxx.xxx.xxx,142.250.67.3,45274,80,0,S,2231896383,,29200,,mss;sackOK;TS;nop;wscale
09:57:20.179850 IP (tos 0x0, ttl 64, id 62917, offset 0, flags [none], proto UDP (17), length 508)
    _gateway.syslog > elk3.5140: [udp sum ok] SYSLOG, length: 480
        Facility local1 (17), Severity notice (5)
        Msg: Dec 21 09:57:20 suricata[1529]: {"timestamp": "2020-12-21T09:57:19.723631+1100", "flow_id": 370259849611631, "in_iface": "igb1", "event_type": "http", "src_ip": "192.168.69.27", "src_port": 42357, "dest_ip": "142.250.66.228", "dest_port": 80, "proto": "TCP", "tx_id": 0, "http": {"hostname": "www.google.com", "url": "/generate_204", "http_user_agent": "afi-inetcheck/1.0", "accept": "*/*", "content_length": "0", "date": "Sun, 20 Dec 2020 22:57:19 GMT", "http_method": "GET"
<HEX REMOVED>

E.......@.w...E...E.......'8<141>Dec 21 09:57:20 suricata[1529]: {"timestamp": "2020-12-21T09:57:19.723631+1100", "flow_id": 370259849611631, "in_iface": "igb1", "event_type": "http", "src_ip": "192.168.69.27", "src_port": 42357, "dest_ip": "142.250.66.228", "dest_port": 80, "proto": "TCP", "tx_id": 0, "http": {"hostname": "www.google.com", "url": "/generate_204", "http_user_agent": "afi-inetcheck/1.0", "accept": "*/*", "content_length": "0", "date": "Sun, 20 Dec 2020 22:57:19 GMT", "http_method": "GET"
09:57:20.179882 IP (tos 0x0, ttl 64, id 18944, offset 0, flags [none], proto UDP (17), length 508)
    _gateway.syslog > elk3.5140: [udp sum ok] SYSLOG, length: 480
        Facility local1 (17), Severity notice (5)
        Msg: Dec 21 09:57:20 suricata[1529]: {"timestamp": "2020-12-21T09:57:19.725975+1100", "flow_id": 753624335485877, "in_iface": "igb1", "event_type": "http", "src_ip": "192.168.69.27", "src_port": 37592, "dest_ip": "142.250.67.3", "dest_port": 80, "proto": "TCP", "tx_id": 0, "http": {"hostname": "www.gstatic.com", "url": "/generate_204", "http_user_agent": "afi-inetcheck/1.0", "accept": "*/*", "content_length": "0", "date": "Sun, 20 Dec 2020 22:57:19 GMT", "http_method": "GET",
<HEX REMOVED>

This is the index management page - looks like it is getting the data in okay.
https://imgur.com/vek1c87

Cheers!

**Comment by a3ilson** [comment]
@spidershark45 - Thanks!

### Overview
- Stop Suricata Logs
- Purge indices 
- Validate Dashboards
- Reconfigure Suricata logs via [these instructions](https://github.com/pfelk/pfelk/wiki/How-To:-Suricata-on-pfSense)


### Probable Culprit - Suricata being sent via syslog (pfSense)
>Stop sending your Suricata logs and then purge all indices (e.g. Navigate to Management>>Stack Management>>Indices and delete all indices).  Let it run, to collect logs, once logs have been received (i.e. Docs count increases) navigate to the firewall dashboard and check to see if the data is being displayed properly. If not, navigate to discover and provide a screenshot.

### Reason/Rationale 
Suricata appears to be mucking up your logs resulting in the various errors.  This was previously identified with issue #111 wherein pfSense truncated Suricata logs being sent via syslog.  Fortunately, there is a workaround/solution which was referenced within step 4c of the [finalization](https://github.com/pfelk/pfelk/blob/master/install/configuration.md) configuration page and an in-dpeth guide on the [Wiki Page](https://github.com/pfelk/pfelk/wiki/How-To:-Suricata-on-pfSense). Alternatively, OPNsense does not have this issue.

Let me know if stopping Suricata and purging your indices yields promising results prior to proceeded to tackle the Suricata portion.

**Comment by spidershark45** [comment]
Thanks @a3ilson! I've tried the following:

- Stopped Suricata logs
- Stopped sending logs from pfsense to the elastic box 
- Deleted all the indices
- Re-enabled the sending of logs to elastic box
- Observed that there was some pfelk-firewall and pfelk-dhcp logs getting directed to elastic again. At some point it stopped receiving them for some reason (firewall stopped at 40 docs count), despite observing that data was flowing in via tcpdump.  https://imgur.com/n1x1gqa
- I rebooted the elastic box and observed that the docs count jumped to 12031. https://imgur.com/ksvuC2k
- Went to the dashboard for Firewall, there didn't appear to be any errors being displayed, but there were no results found. https://imgur.com/afbMHJb (same thing for DHCP dashboard as well)
- Went to discover and changed the filter to the last day and couldn't see any data in there either. https://imgur.com/MqWpwAj

**Comment by a3ilson** [comment]
Can you provide the logstash log file again?

**Comment by a3ilson** [comment]
Please provide the logstash log `/var/log/logstash/logstash-plain.log` I've manually parsed out all previously provide firewall logs (from tcpdump).

**Comment by spidershark45** [comment]
Thanks @a3ilson 

I've attached the logstash-plan 
[logstash-plain.log](https://github.com/pfelk/pfelk/files/5726997/logstash-plain.log)

**Comment by a3ilson** [comment]
Appears to be good - nothing of concern noted.

Any chance you can increase the allocated RAM?  

I'm still unsure where the previous error is being derived from (```Grok regexp threw exception {:exception=>"Could not set field 'action' on object '/index.php' to value ' Successful login'.```)

I've installed this same setup a half dozen times and unable to replicate this particular issue...Can you elaborate more on your setup (hardware)?

**Comment by spidershark45** [comment]
Thanks @a3ilson 

No problem, current config is as follows:
- pfsense is running on bare metal - dell optiplex
- ELK is running within vmware workstation on my old gaming rig (AMD 2700x, 32GB DDR4 memory), it has 4x CPUs (2x2), 4GB memory, 80GB assigned to it. Network adapter is bridged.
- I just upped the memory from 4GB to 8GB and still not having any luck seeing any data in discover or the dashboards.

My plan was to get the vm working in workstation before moving it onto an ESXi host to live permanently. Is it worthwhile setting up a fresh vm on the ESXi and start the process from scratch? Perhaps I'll try just getting the firewall logs working first before trying to get suricata in there as well.

**Comment by a3ilson** [comment]
@spidershark45 - This one is a bit of a head scratcher...I'll take another fresh look at it again tomorrow.

I would recommend spinning it up on an ESXi host (VM). You can create a fresh install of Ubuntu and take a snapshot. Then you'll be able to easily revert back to your fresh install via previously created snapshot.  I ran mine on Proxmox and ESXi - it's currently running on ESXi.

### Random Thoughts/Notes:
- pfSense >> ElasticStack (VM) both reachable via IP address (i.e. same network [e.g. 192.168.0.0/24])
  - Possible concerns:
    - Firewall rules on the client
    - Firewall rules on VMWare workstation
      - Unlikely...tcpdump yields parseable logs (validate via manual grok debugger
      - Kibana is reachable
      - Elasticsearch is operational via Kibana 
- Create updated YouTube installation tutorial (previous tutorials are dated based on a prior installation instructions)

### Way Ahead
- Give ESXi installation a try and see if it works if so let me know and I'll note the known issues with VMWare Workstation
- I'll conduct a fresh installation based on ESXi, Ubuntu and the scripted installation method (will also make a manual and docker variant at a later time)

**Comment by a3ilson** [comment]
Any luck on the ESXi install?

**Comment by spidershark45** [comment]
Hey @a3ilson - haven't had a chance yet. I'm hoping to get some time on boxing day to have a play with it.

Will keep you posted

**Comment by a3ilson** [comment]
@spidershark45 - Since this issue, a video tutorial for dashboards and templates was posted on [YouTube](https://www.youtube.com/watch?v=KV27ouVUGuc). If you still need assistance please reopen the issue.

Issue closed due pending response.
