### ISSUE TITLE
Firewall dashboard Ok, but suricata dashboard not in 22.01

### ISSUE THREAD

**Issue by sky17radio** [pfelk/pfelk#384]
Dear developers! After installing version 22.01 (03/01/2022), the firewall panel works flawlessly, but again there is a problem with the suricata panel. Data comes only from the firewall in the Analytics-> Discover section. Plus, the new version 01-inputs.conf describes input only via port port => 5140, while the detailed description of the pfsense configuration (given on the page https://github.com/pfelk/pfelk/wiki/ How-To: -Suricata-on-pfSense) - here the output is described as
{
   tcp ("logstash.local"
   port (5040)
   failover (servers ("192.168.0.10", "10.0.0.10"))
   );
};
Maybe some of the code is lost in the new 01-inputs.conf with port 5040? Or do you need to configure suricata outout in syslog-ng differently?
Sincerely, Alexander 

**Screenshots**

**Firewall System (please complete the following information):**
 - pfSense
 - Version 2.5.2 
 
**Operating System (please complete the following information):**
 - OS (`printf "$(uname -srm)\n$(cat /etc/os-release)\n"`):
 - [root@CentOS8ELK22 ~]# printf "$(uname -srm)\n$(cat /etc/os-release)\n"
Linux 4.18.0-348.2.1.el8_5.x86_64 x86_64
NAME="CentOS Linux"
VERSION="8"
ID="centos"
ID_LIKE="rhel fedora"
VERSION_ID="8"
PLATFORM_ID="platform:el8"
PRETTY_NAME="CentOS Linux 8"
ANSI_COLOR="0;31"
CPE_NAME="cpe:/o:centos:centos:8"
HOME_URL="https://centos.org/"
BUG_REPORT_URL="https://bugs.centos.org/"
CENTOS_MANTISBT_PROJECT="CentOS-8"
CENTOS_MANTISBT_PROJECT_VERSION="8"
[root@CentOS8ELK22 ~]#
 
 **Installation method (manual, ansible-playbook, docker, script):**
 manual

**Elasticsearch, Logstash, Kibana (please complete the following information):**
 - Version of ELK components (`dpkg -l [elasticsearch]|[logstash]|[kibana]`)
 
 **Elasticsearch, Logstash, Kibana logs:**
 - Elasticsearch logs (`tail -f /var/log/elasticsearch/[your-elk-cluster-name].log`)
 - [root@CentOS8ELK22 elasticsearch]# tail -f /var/log/elasticsearch/elasticsearch.log
[2022-01-03T20:15:14,586][INFO ][o.e.i.g.DatabaseNodeService] [CentOS8ELK22.local.net] successfully reloaded changed geoip database file [/tmp/elasticsearch-16495595799013858266/geoip-databases/gU40zq-SSXuG_GOLdW-J6g/GeoLite2-ASN.mmdb]
[2022-01-03T20:15:14,967][INFO ][o.e.i.g.GeoIpDownloader  ] [CentOS8ELK22.local.net] geoip database [GeoLite2-City.mmdb] is up to date, updated timestamp
[2022-01-03T20:15:15,631][INFO ][o.e.i.g.DatabaseNodeService] [CentOS8ELK22.local.net] successfully reloaded changed geoip database file [/tmp/elasticsearch-16495595799013858266/geoip-databases/gU40zq-SSXuG_GOLdW-J6g/GeoLite2-City.mmdb]
[2022-01-03T20:15:15,726][INFO ][o.e.i.g.GeoIpDownloader  ] [CentOS8ELK22.local.net] geoip database [GeoLite2-Country.mmdb] is up to date, updated timestamp
[2022-01-03T20:15:16,162][INFO ][o.e.c.r.a.AllocationService] [CentOS8ELK22.local.net] Cluster health status changed from [RED] to [YELLOW] (reason: [shards started [[.ds-.logs-deprecation.elasticsearch-default-2022.01.03-000001][0]]]).
[2022-01-03T20:15:29,354][INFO ][o.e.t.LoggingTaskListener] [CentOS8ELK22.local.net] 225 finished with response BulkByScrollResponse[took=339.7ms,timed_out=false,sliceId=null,updated=17,created=0,deleted=0,batches=1,versionConflicts=0,noops=0,retries=0,throttledUntil=0s,bulk_failures=[],search_failures=[]]
[2022-01-03T20:15:29,410][INFO ][o.e.t.LoggingTaskListener] [CentOS8ELK22.local.net] 222 finished with response BulkByScrollResponse[took=658.9ms,timed_out=false,sliceId=null,updated=148,created=0,deleted=0,batches=1,versionConflicts=0,noops=0,retries=0,throttledUntil=0s,bulk_failures=[],search_failures=[]]
[2022-01-03T20:15:33,248][INFO ][o.e.x.i.a.TransportPutLifecycleAction] [CentOS8ELK22.local.net] updating index lifecycle policy [.alerts-ilm-policy]
[2022-01-03T20:15:59,882][INFO ][o.e.c.m.MetadataMappingService] [CentOS8ELK22.local.net] [.ds-logs-pfelk-firewall-2022.01.03-000001/0RRnXkZfSIWk5nHkXO0ABg] update_mapping [_doc]
[2022-01-03T20:18:26,173][INFO ][o.e.c.m.MetadataMappingService] [CentOS8ELK22.local.net] [.ds-logs-pfelk-firewall-2022.01.03-000001/0RRnXkZfSIWk5nHkXO0ABg] update_mapping [_doc]

 - Logstash logs (`tail -f /var/log/logstash/logstash-plain.log`)
[root@CentOS8ELK22 elasticsearch]# tail -f /var/log/logstash/logstash-plain.log
[2022-01-03T20:15:54,455][INFO ][logstash.filters.geoip.databasemanager][pfelk] GeoIP database path is configured manually so the plugin will not check for update. Keep in mind that if you are not using the database shipped with this plugin, please go to https://www.maxmind.com/en/geolite2/eula and understand the terms and conditions.
[2022-01-03T20:15:54,455][INFO ][logstash.filters.geoip   ][pfelk] Using geoip database {:path=>"/usr/share/GeoIP/GeoLite2-ASN.mmdb"}
[2022-01-03T20:15:54,659][INFO ][logstash.javapipeline    ][pfelk] Starting pipeline {:pipeline_id=>"pfelk", "pipeline.workers"=>2, "pipeline.batch.size"=>125, "pipeline.batch.delay"=>50, "pipeline.max_inflight"=>250, "pipeline.sources"=>["/etc/pfelk/conf.d/01-inputs.conf", "/etc/pfelk/conf.d/05-apps.conf", "/etc/pfelk/conf.d/20-interfaces.conf", "/etc/pfelk/conf.d/30-geoip.conf", "/etc/pfelk/conf.d/35-rules-desc.conf", "/etc/pfelk/conf.d/36-ports-desc.conf", "/etc/pfelk/conf.d/37-enhanced_user_agent.conf", "/etc/pfelk/conf.d/38-enhanced_url.conf", "/etc/pfelk/conf.d/45-cleanup.conf", "/etc/pfelk/conf.d/49-enhanced_private.conf", "/etc/pfelk/conf.d/50-outputs.conf"], :thread=>"#<Thread:0x6a6cad28 run>"}
[2022-01-03T20:15:58,021][INFO ][logstash.javapipeline    ][pfelk] Pipeline Java execution initialization time {"seconds"=>3.34}
[2022-01-03T20:15:58,248][INFO ][logstash.javapipeline    ][pfelk] Pipeline started {"pipeline.id"=>"pfelk"}
[2022-01-03T20:15:58,269][INFO ][logstash.inputs.syslog   ][pfelk][pfelk-firewall-0001] Starting syslog tcp listener {:address=>"0.0.0.0:5140"}
[2022-01-03T20:15:58,264][INFO ][logstash.inputs.syslog   ][pfelk][pfelk-firewall-0001] Starting syslog udp listener {:address=>"0.0.0.0:5140"}
[2022-01-03T20:15:58,302][INFO ][logstash.agent           ] Pipelines running {:count=>1, :running_pipelines=>[:pfelk], :non_running_pipelines=>[]}
[2022-01-03T20:16:24,782][INFO ][logstash.inputs.syslog   ][pfelk][pfelk-firewall-0001] new connection {:client=>"1.1.1.254:1650"}
[2022-01-03T21:00:05,218][INFO ][logstash.inputs.syslog   ][pfelk][pfelk-firewall-0001] new connection {:client=>"1.1.1.254:39882"}

 - Kibana logs (`journalctl -u kibana.service`)
[root@CentOS8ELK22 elasticsearch]# journalctl -u kibana.service
-- Logs begin at Mon 2022-01-03 20:14:47 MSK, end at Mon 2022-01-03 21:25:41 MSK. --
янв 03 20:14:50 CentOS8ELK22.local.net systemd[1]: Started Kibana.

**Additional context**

**Attach the pfELK Error Log (error.pfelk), for Better Assistance***
 - Do not copy/paste log; attach as a file
![_01_FireWall](https://user-images.githubusercontent.com/96719330/147966163-56b97a80-6484-4a2d-a824-126900901386.png)
![_02_Discover](https://user-images.githubusercontent.com/96719330/147966168-6c2d7bee-1fe7-416e-a561-586e1183f028.png)
![_11_Sur01 - копия](https://user-images.githubusercontent.com/96719330/147966170-30d9ca73-3bfb-46cb-a57e-4e5758fea922.png)
![_11_Sur01](https://user-images.githubusercontent.com/96719330/147966171-1d8c3d42-0e73-4b01-b1ad-0c54dbb4a6fd.png)
![_12_Sur02](https://user-images.githubusercontent.com/96719330/147966174-8be21054-ecd7-41d5-8ca0-230149c3dd46.png)
![_13_Sur03](https://user-images.githubusercontent.com/96719330/147966175-95f1f0b1-023e-4bd8-b735-cecee0f6c2b4.png)
![_14_Sur04](https://user-images.githubusercontent.com/96719330/147966177-89f2082c-2604-4f91-a578-e78c9d1b44fa.png)
![_15_Sur05](https://user-images.githubusercontent.com/96719330/147966178-9e89c8b6-05c3-4cfe-a57c-3dfb2333ab76.png)
![_16_Sur06](https://user-images.githubusercontent.com/96719330/147966180-ace480bc-d41a-4d55-9906-8b3586eb93cd.png)
![_17_Sur07](https://user-images.githubusercontent.com/96719330/147966181-88813fd5-8a28-4cbf-b838-30672ec35104.png)
[source_sur.txt.txt](https://github.com/pfelk/pfelk/files/7803436/source_sur.txt.txt)

My config files from discribed configuration in /etc/pfelk/conf.d are

[20-interfaces_conf.txt](https://github.com/pfelk/pfelk/files/7803449/20-interfaces_conf.txt)
[30-geoi_conf.txt](https://github.com/pfelk/pfelk/files/7803450/30-geoi_conf.txt)
[01-inputs_conf.txt](https://github.com/pfelk/pfelk/files/7803451/01-inputs_conf.txt)
[05-apps_conf.txt](https://github.com/pfelk/pfelk/files/7803452/05-apps_conf.txt)
[35-rules-desc_conf.txt](https://github.com/pfelk/pfelk/files/7803453/35-rules-desc_conf.txt)
[36-ports-desc_conf.txt](https://github.com/pfelk/pfelk/files/7803454/36-ports-desc_conf.txt)
[37-enhanced_user_agent_conf.txt](https://github.com/pfelk/pfelk/files/7803455/37-enhanced_user_agent_conf.txt)
[38-enhanced_url_conf.txt](https://github.com/pfelk/pfelk/files/7803456/38-enhanced_url_conf.txt)
[45-cleanup_conf.txt](https://github.com/pfelk/pfelk/files/7803457/45-cleanup_conf.txt)
[49-enhanced_private_conf.txt](https://github.com/pfelk/pfelk/files/7803458/49-enhanced_private_conf.txt)
[50-outputs_conf.txt](https://github.com/pfelk/pfelk/files/7803459/50-outputs_conf.txt)

**Comment by revere521** [comment]
it looks like now the inputs file expects ingestion of all logs on port 5140
I have not updated yet (im slow in more ways than one) but try setting the destination config in syslog-ng as: 
```
{
   tcp("192.168.0.10"
   port(5140)
   );
};
```

thats simplified over the failover config that may be in the Wiki, but that has consistently worked for me on the 21.xx versions. 

I still have an onus of updating, and may try to do that later this evening if I can, and will test getting it all working

**Comment by sky17radio** [comment]
Thanks, I will try, I will write

**Comment by revere521** [comment]
if the Syslog-ng config in the screencaps is yours, it looks like you may already have it set that way.  You may want to choose LAN as the interface group though, and not WAN

**Comment by sky17radio** [comment]
Ok, I will add LAN to the interface group, WAN is selected there because the node with ELK Stack (3.3.3.9) is accessible via the WAN (1.1.1.254) interface, and not via LAN (10.36.15.1). I have a model network with a Linux router with 3 segments 1.1.1.0/24 (victims) 2.2.2.0/24 (attackers) and 3.3.3.0/24 (persistent services segment). These three segments have transparent routing. The tcpdump service shows that messages from suricata reach the ELK Stack: 

22:31:54.978685 IP CentOS8ELK22.local.net.5140 > 1.1.1.254.46420: Flags [.], ack 3790, win 286, options [nop,nop,TS val 3386641994 ecr 837427563], length 0
22:31:55.388445 IP 1.1.1.254.syslog > CentOS8ELK22.local.net.5140: SYSLOG local0.info, length: 191
22:31:55.388466 IP 1.1.1.254.syslog > CentOS8ELK22.local.net.5140: SYSLOG local0.info, length: 191
22:31:55.388469 IP 1.1.1.254.syslog > CentOS8ELK22.local.net.5140: SYSLOG local0.info, length: 225
22:31:55.388497 IP 1.1.1.254.syslog > CentOS8ELK22.local.net.5140: SYSLOG local0.info, length: 225
22:31:55.826361 IP 1.1.1.254.syslog > CentOS8ELK22.local.net.5140: SYSLOG local5.info, length: 289
22:31:56.388491 IP 1.1.1.254.syslog > CentOS8ELK22.local.net.5140: SYSLOG local0.info, length: 225
22:31:56.388527 IP 1.1.1.254.syslog > CentOS8ELK22.local.net.5140: SYSLOG local0.info, length: 225
22:31:56.388575 IP 1.1.1.254.syslog > CentOS8ELK22.local.net.5140: SYSLOG local0.info, length: 225
22:31:56.911131 IP 1.1.1.254.syslog > CentOS8ELK22.local.net.5140: SYSLOG local5.info, length: 264
22:31:56.999161 IP 1.1.1.254.46420 > CentOS8ELK22.local.net.5140: Flags [P.], seq 3790:4582, ack 1, win 514, options [nop,nop,TS val 837429583 ecr 3386641994], length 792
22:31:56.999189 IP CentOS8ELK22.local.net.5140 > 1.1.1.254.46420: Flags [.], ack 4582, win 309, options [nop,nop,TS val 3386644014 ecr 837429583], length 0
22:31:57.388483 IP 1.1.1.254.syslog > CentOS8ELK22.local.net.5140: SYSLOG local0.info, length: 191
22:31:57.388510 IP 1.1.1.254.syslog > CentOS8ELK22.local.net.5140: SYSLOG local0.info, length: 191
22:31:57.388512 IP 1.1.1.254.syslog > CentOS8ELK22.local.net.5140: SYSLOG local0.info, length: 225

**Comment by sky17radio** [comment]
![_18_NETW](https://user-images.githubusercontent.com/96719330/147973099-4ac2283c-07d3-442a-808d-7645dff8a802.png)

**Comment by sky17radio** [comment]
And in the new 22.01 version, 01-inputs_conf.txt contains syslog
input {
   ### Firewall ###
   syslog {
     id => "pfelk-firewall-0001"
     type => "firewall"
     port => 5140
if syslog - does it generally receive a stream via UDP and not TCP?

**Comment by revere521** [comment]
sorry, if WAN is appropriate in your case then that is fine, i was thinking in much simpler terms.  Yes, it does make sense that it should be UDP to ingest along with the other syslogs.  I can see that the 05-apps config now uses the process name to further refine the suricata stream.   

in my source config in syslog-ng i added a program override for suricata to make sure it adds that name to the log strings.  I think this is in the wiki, or its at least mentioned in the section:

```
{
  wildcard-file(
    base-dir("/var/log/suricata")
    filename-pattern("eve.json")
    recursive(yes)
    follow-freq(1)
    program-override("suricata")
    flags(no-parse)
  );
};
```

**Comment by sky17radio** [comment]
I temporarily disabled sending firewall, dhcp, etc. events in the pfsense setup and left only sending suricata events using syslog-ng, on UDP port 5140 (similar to that described in wikipedia). Next, I left only the 01-inputs.conf file in the /etc/pfelk/conf.d/ directory, adding the standard output blog as shown below:
output {
   stdout {
    }
   file {
         path => "/var/log/logstash/01-inp-outp-tlk.txt"
     }
}
As you can see, suricata events are being received (see screenshot and log). Is there a mistake that the source of events is "suricata:" and not "suricata" after the initial GROK filter in 01-inputs.conf?
[01-inp-outp-tlk.txt](https://github.com/pfelk/pfelk/files/7805905/01-inp-outp-tlk.txt)
![_21_suricata_acts](https://user-images.githubusercontent.com/96719330/148022457-56a3968e-2599-4182-ac67-7dc26b210f63.png)

**Comment by sky17radio** [comment]
In the latter case, logstash was started manually. The process stopped first
[root @ CentOS8ELK22 conf.d] # systemctl stop logstash
and then in a minute
[root @ CentOS8ELK22 conf.d] # /usr/share/logstash/bin/logstash -f /etc/pfelk/conf.d/01-inputs.conf

**Comment by revere521** [comment]
my original messages have the process name as `suricata:`  with the colon, so the regex may not be parsing it out.  looking to see if its in 01-inputs

**Comment by revere521** [comment]
The regex for the current 01-inputs seems to parse out the colon in the grok debugger, can you replace your current 01-inputs with the one in the repo and then test again?   then see what comes into the discover view. 

![Firefox_Screenshot_2022-01-04T12-27-06 899Z](https://user-images.githubusercontent.com/23560313/148059116-c874dd88-3000-4f60-9c05-6ca3cded2581.png)

**Comment by sky17radio** [comment]
My output is similar to yours, but only in the input message there is an extra "\\" character, and in the output message in the "filer_message" field this extra character is doubled and turns into "\\\\"
![_31_GrokDebug01](https://user-images.githubusercontent.com/96719330/148085190-c3b581f3-78ec-4d88-ae71-ea4fe3bffc4d.png)

**Comment by sky17radio** [comment]
It is very likely that a stream comes from pfsense with these extra characters "\\\". I tried to add to the syslog-ng configuration in pfsense, in addition to the already suggested "flags (no-parse)" instruction, also "unix-dgram ()" as suggested here
https://stackoverflow.com/questions/61327986/display-special-character-in-json-log-with-syslog-ng
but this setting cannot be saved - an error is generated.
![_41_Extra](https://user-images.githubusercontent.com/96719330/148091738-e090987f-b579-42ae-b663-b19ccdbf2360.png)

**Comment by sky17radio** [comment]
The original pfsense file in /var/log/suricata/vtnet15789 is fine, there are no redundant "\\\" characters in it:

[2.5.2-RELEASE] [root@pfsensevc.local.net] / root: cd /var/log/suricata/suricata_vtnet15789

[2.5.2-RELEASE] [root@pfsensevc.local.net] /var/log/suricata/suricata_vtnet15789: tail eve.json
{"timestamp": "2022-01-04T20: 13: 56.497266 + 0300", "flow_id": 2176678693735554, "in_iface": "vtnet1", "event_type": "dns", "src_ip": "10.36.15.3" , "src_port": 54821, "dest_ip": "192.168.132.25", "dest_port": 53, "proto": "UDP", "dns": {"version": 2, "type": "answer", "id": 47321, "flags": "8183", "qr": true, "rd": true, "ra": true, "rrname": "win8.ipv6.microsoft.com", "rrtype": "A", "rcode": "NXDOMAIN"}}
{"timestamp": "2022-01-04T20: 14: 19.040555 + 0300", "flow_id": 1455394772459115, "in_iface": "vtnet1", "event_type": "dns", "src_ip": "10.36.15.3" , "src_port": 62288, "dest_ip": "192.168.132.25", "dest_port": 53, "proto": "UDP", "dns": {"type": "query", "id": 43492, "rrname": "contile.services.mozilla.com", "rrtype": "A", "tx_id": 0}}
{"timestamp": "2022-01-04T20: 14: 19.071457 + 0300", "flow_id": 321849823794977, "in_iface": "vtnet1", "event_type": "dns", "src_ip": "10.36.15.3" , "src_port": 62288, "dest_ip": "8.8.8.8", "dest_port": 53, "proto": "UDP", "dns": {"type": "query", "id": 43492, "rrname": "contile.services.mozilla.com", "rrtype": "A", "tx_id": 0}}
{"timestamp": "2022-01-04T20: 14: 19.093779 + 0300", "flow_id": 321849823794977, "in_iface": "vtnet1", "event_type": "dns", "src_ip": "10.36.15.3" , "src_port": 62288, "dest_ip": "8.8.8.8", "dest_port": 53, "proto": "UDP", "dns": {"version": 2, "type": "answer", "id": 43492, "flags": "8180", "qr": true, "rd": true, "ra": true, "rrname": "contile.services.mozilla.com", "rrtype": "A", "rcode": "NOERROR", "answers": [{"rrname": "contile.services.mozilla.com", "rrtype": "A", "ttl": 246, "rdata": "34.117.237.239"}], "grouped": {"A": ["34.117.237.239"]}}}
{"timestamp": "2022-01-04T20: 14: 19.080445 + 0300", "flow_id": 1455394772459115, "in_iface": "vtnet1", "event_type": "dns", "src_ip": "10.36.15.3" , "src_port": 62288, "dest_ip": "192.168.132.25", "dest_port": 53, "proto": "UDP", "dns": {"version": 2, "type": "answer", "id": 43492, "flags": "8180", "qr": true, "rd": true, "ra": true, "rrname": "contile.services.mozilla.com", "rrtype": "A", "rcode": "NOERROR", "answers": [{"rrname": "contile.services.mozilla.com", "rrtype": "A", "ttl": 464, "rdata": "34.117.237.239"}], "grouped": {"A": ["34.117.237.239"]}, "authorities": [{"rrname": "services.mozilla.com", "rrtype": "NS "," ttl ": 155683}, {" rrname ":" services.mozilla.com "," rrtype ":" NS "," ttl ": 155683}, {" rrname ":" services.mozilla.com ", "rrtype": "NS", "ttl": 155683}, {"rrname": "services.mozilla.com", "rrtype": "NS", "ttl": 155683}]}}

**Comment by revere521** [comment]
ok, so i am upgraded - and experiencing the suricata condition you are (no ingestion) - but not the issue with the extra slashes. 

Instead, i set my output to a test log file - that is in destination i changed the object parameter to just `{ file("/var/syslog-ng/test.log"); };`

when i look at whats generated - i see that syslog-ng is dropping the priority; like this: 

```
Jan  4 12:54:01 pfSense suricata: {"timestamp":"2022-01-04T12:53:58.107566-0500","flow_id":1306385332309866,"in_iface":"re0","event_type":"dns","src_ip":"192.168.1.109","src_port":53225,"dest_ip":"192.168.1.1","dest_port":53,"proto":"UDP","dns":{"type":"query","id":53684,"rrname":"nav.smartscreen.microsoft.com","rrtype":"A","tx_id":2}}
Jan  4 12:54:01 pfSense suricata: {"timestamp":"2022-01-04T12:53:58.231826-0500","flow_id":1306385332309866,"in_iface":"re0","event_type":"dns","src_ip":"192.168.1.109","src_port":53225,"dest_ip":"192.168.1.1","dest_port":53,"proto":"UDP","dns":{"type":"query","id":53684,"rrname":"nav.smartscreen.microsoft.com","rrtype":"A","tx_id":3}}
Jan  4 12:54:01 pfSense suricata: {"timestamp":"2022-01-04T12:53:58.266831-0500","flow_id":1306385332309866,"in_iface":"re0","event_type":"dns","src_ip":"192.168.1.109","src_port":53225,"dest_ip":"192.168.1.1","dest_port":53,"proto":"UDP","dns":{"version":2,"type":"answer","id":53684,"flags":"8180","qr":true,"rd":true,"ra":true,"rrname":"nav.smartscreen.microsoft.com","rrtype":"A","rcode":"NOERROR","answers":[{"rrname":"nav.smartscreen.microsoft.com","rrtype":"CNAME","ttl":1702,"rdata":"wd-prod-ss.trafficmanager.net"},{"rrname":"wd-prod-ss.trafficmanager.net","rrtype":"CNAME","ttl":245,"rdata":"wd-prod-ss-us-west-1-fe.westus.cloudapp.azure.com"},{"rrname":"wd-prod-ss-us-west-1-fe.westus.cloudapp.azure.com","rrtype":"A","ttl":10,"rdata":"40.78.63.86"}],"grouped":{"CNAME":["wd-prod-ss.trafficmanager.net","wd-prod-ss-us-west-1-fe.westus.cloudapp.azure.com"],"A":["40.78.63.86"]}}}
Jan  4 12:54:01 pfSense suricata: {"timestamp":"2022-01-04T12:53:58.266842-0500","flow_id":1306385332309866,"in_iface":"re0","event_type":"dns","src_ip":"192.168.1.109","src_port":53225,"dest_ip":"192.168.1.1","dest_port":53,"proto":"UDP","dns":{"version":2,"type":"answer","id":53684,"flags":"8180","qr":true,"rd":true,"ra":true,"rrname":"nav.smartscreen.microsoft.com","rrtype":"A","rcode":"NOERROR","answers":[{"rrname":"nav.smartscreen.microsoft.com","rrtype":"CNAME","ttl":1702,"rdata":"wd-prod-ss.trafficmanager.net"},{"rrname":"wd-prod-ss.trafficmanager.net","rrtype":"CNAME","ttl":245,"rdata":"wd-prod-ss-us-west-1-fe.westus.cloudapp.azure.com"},{"rrname":"wd-prod-ss-us-west-1-fe.westus.cloudapp.azure.com","rrtype":"A","ttl":10,"rdata":"40.78.63.86"}],"grouped":{"A":["40.78.63.86"],"CNAME":["wd-prod-ss.trafficmanager.net","wd-prod-ss-us-west-1-fe.westus.cloudapp.azure.com"]}}}
Jan  4 12:54:01 pfSense suricata: {"timestamp":"2022-01-04T12:53:58.514476-0500","flow_id":786028570219707,"in_iface":"re0","event_type":"tls","src_ip":"192.168.1.109","src_port":60500,"dest_ip":"40.78.63.86","dest_port":443,"proto":"TCP","tls":{"subject":"C=US, ST=WA, L=Redmond, O=Microsoft Corporation, CN=smartscreen.microsoft.com","issuerdn":"C=US, O=Microsoft Corporation, CN=Microsoft Azure TLS Issuing CA 06","serial":"33:00:22:FB:DB:A8:8D:DE:A8:AC:B8:59:5B:00:00:00:22:FB:DB","fingerprint":"4a:98:c4:64:95:9e:c6:bc:f3:27:d2:70:ec:1f:93:37:32:ce:01:60","sni":"nav.smartscreen.microsoft.com","version":"TLS 1.2","notbefore":"2021-12-23T06:15:55","notafter":"2022-12-18T06:15:55","ja3":{},"ja3s":{}}}
Jan  4 12:54:03 pfSense suricata: {"timestamp":"2022-01-04T12:54:02.845472-0500","flow_id":568179236717545,"in_iface":"re0","event_type":"dns","src_ip":"192.168.1.101","src_port":63337,"dest_ip":"192.168.1.1","dest_port":53,"proto":"UDP","dns":{"type":"query","id":50887,"rrname":"detectportal.firefox.com","rrtype":"A","tx_id":4}}
```

so each line does not start with `<some number>` like `<13>`  - which fails the first part of the grok pattern match....

**Comment by revere521** [comment]
well, i can't find the answer yet, i changed the regex in the 01-inputs to ignore the missing priority like this: 
```
<?%{POSINT:[log][syslog][priority]}?>?
```

then also set my destination object config to use the new `network()`  object since tcp() and udp() are now depreciated

```
{
   network("192.168.1.117"
   port(5140)
   );
};
```

**Comment by sky17radio** [comment]
Ok. I'm trying to exclude slashes

**Comment by revere521** [comment]
I understand, since we are dealing with different OSes there may be quirks in parallel that don't present.   the parsing that syslogng does is still not very clear to me, and suricata from my pfsense instance does not have any slashes at all.

**Comment by sky17radio** [comment]
As a result, I noticed by manually running logstash that in my case, after the primary GROK filter in 01-inputs.conf, the "process name" is returned as "suricata:" and not "suricata".
In my case, the situation was resolved due to the following:
1. In the file 05-apps.com replaced 
string
  if [process] [name] = ~ / ^ suricata $ / {
per line
  if [process] [name] = ~ / ^ suricata: $ / {
2. In the 50-outputs.conf file, replaced the line
} else if [process] [name] == "suricata" {
per line
 } else if [process] [name] == "suricata:" {
After that, charts began to appear on the suricata dashboard. Below are the working configs (in txt format, you need to rename if used in * .conf). You helped a lot in the end to figure out and solve the problem!
I ran pfelk with pfsense 2.5.2 and CentOS 8 with ELK Stack.
[01-inputs_conf.txt](https://github.com/pfelk/pfelk/files/7812489/01-inputs_conf.txt)
[05-apps_conf.txt](https://github.com/pfelk/pfelk/files/7812490/05-apps_conf.txt)
[20-interfaces_conf.txt](https://github.com/pfelk/pfelk/files/7812491/20-interfaces_conf.txt)
[30-geoip_conf.txt](https://github.com/pfelk/pfelk/files/7812492/30-geoip_conf.txt)
[35-rules-desc_conf.txt](https://github.com/pfelk/pfelk/files/7812493/35-rules-desc_conf.txt)
[36-ports-desc_conf.txt](https://github.com/pfelk/pfelk/files/7812494/36-ports-desc_conf.txt)
[37-enhanced_user_agent_conf.txt](https://github.com/pfelk/pfelk/files/7812495/37-enhanced_user_agent_conf.txt)
[38-enhanced_url_conf.txt](https://github.com/pfelk/pfelk/files/7812496/38-enhanced_url_conf.txt)
[45-cleanup_conf.txt](https://github.com/pfelk/pfelk/files/7812497/45-cleanup_conf.txt)
[49-enhanced_private_conf.txt](https://github.com/pfelk/pfelk/files/7812498/49-enhanced_private_conf.txt)
[50-outputs_conf.txt](https://github.com/pfelk/pfelk/files/7812499/50-outputs_conf.txt)

![_61_SuricataGood](https://user-images.githubusercontent.com/96719330/148171328-b0b4e6c7-4d76-4e82-a1c9-4f2b7253b161.png)

File for manual testing of conversions 
[01m-inputs_conf.txt](https://github.com/pfelk/pfelk/files/7812505/01m-inputs_conf.txt)


![_62_SuricataDublComma](https://user-images.githubusercontent.com/96719330/148171511-01641bcc-173d-4a2c-a018-9db90f0a2202.png)

**Comment by revere521** [comment]
Interesting, that works for me as well....   there may be something that can be done in 01-inputs to drop the colon from the log string if it appears.  I wonder if its an extra colon in the string since there is no PID from suricata.  

Either way, this is a workaround while the fix is investigated

**Comment by a3ilson** [comment]
There was a change with the latest versions grok pattern:

The prior versions was:
```
<%{POSINT:[log][syslog][priority]}>?(%{INT:[log][syslog][version]}\s*)?(%{SYSLOGTIMESTAMP:[event][created]}|%{TIMESTAMP_ISO8601:[event][created]})\s(%{DATA:[host][name]}\s+)?%{PROG:[process][name]}\s*?(\[)?%{POSINT:[process][pid]}(\]:)?\s*(\-\s*\-)?\s*%{GREEDYDATA:filter_message}|%{POSINT:[log][syslog][priority]}?(%{INT:[log][syslog][version]}\s*)?(%{SYSLOGTIMESTAMP:[event][created]}|%{TIMESTAMP_ISO8601:[event][created]})\s(%{SYSLOGHOST:[host][name]}\s+)?%{PROG:[process][name]}\:\s%{GREEDYDATA:filter_message}
```

The latest version is:
```
<%{POSINT:[log][syslog][priority]}>?(%{INT:[log][syslog][version]}\s*)?(%{SYSLOGTIMESTAMP:[event][created]}|%{TIMESTAMP_ISO8601:[event][created]})\s(%{SYSLOGHOST:[host][name]}\s+)?%{PROG:[process][name]}\s*?(\[)?(%{POSINT:[process][pid]}(\]:)?)?\s*(\-\s*\-)?\s*%{GREEDYDATA:filter_message}
```

I rewrote, in an attempt to clean it up. Unfortunately, @pfSense and their non consistent syslog output causes issues. The solution provided by @sky17radio works as would utilizing the prior GROK filter in place of the current one within 01-inputs.conf.  

I've attempting to remove the colon with the updated grok but  it when attempting to escape with the option. Meaning if there is no colon the grok pattern fails.

**Comment by a3ilson** [comment]
@revere521 / @sky17radio 

Give this a try:
* Update 01-inputs.conf as follows:
```
# 01-inputs.conf
################################################################################
# Version: 22.02                                                               #
# Required: Yes                                                                #
# Description: Sets the type, port to listen, and initial grok pattern. User   #
# may amend at their own risk, as desired.                                     #
################################################################################
#
input {
  ### Firewall ###
  syslog {
    id => "pfelk-firewall-0001"
    type => "firewall"
    port => 5140
    syslog_field => "message"
    ecs_compatibility => v1
    grok_pattern => "<%{POSINT:[log][syslog][priority]}>?(%{INT:[log][syslog][version]}\s*)?(%{SYSLOGTIMESTAMP:[event][created]}|%{TIMESTAMP_ISO8601:[event][created]})\s(%{SYSLOGHOST:[host][name]}\s+)?(%{PROG:[process][name]}\:|%{PROG:[process][name]})\s*?(\[)?(%{POSINT:[process][pid]}(\]:)?)?\s*(\-\s*\-)?\s*%{GREEDYDATA:filter_message}"
    #ssl => true
    #ssl_certificate_authorities => ["/etc/logstash/ssl/YOURCAHERE.crt"]
    #ssl_certificate => "/etc/logstash/ssl/SERVER.crt"
    #ssl_key => "/etc/logstash/ssl/SERVER.key"
    #ssl_verify_mode => "force_peer"
    tags => ["pfelk"]
  }
  ### Beats ###
#  beats {
#    id => "beats"
#    type => "beats"
#    port => 5044
#  }
}
#### Syslog Date Format Fix #### 
filter {
  date {
    match => [ "[event][created]", "MMM  d HH:mm:ss", "MMM dd HH:mm:ss", "ISO8601" ]
    target => "[event][created]"
  }
}
```

Revert your 05-apps.conf to [this](https://raw.githubusercontent.com/pfelk/pfelk/main/etc/pfelk/conf.d/05-apps.conf) one. 

Additionally, you can provide some pfSense logs or test the grok filter with your current pfSesne logs to confirm it doesn't break something else in the process.

**Comment by revere521** [comment]
i am testing the 01-inputs and the 05-apps,  i also had to update the pattern (and i may need to look at what else is new) to account for the $NGINX references

**Comment by revere521** [comment]
I had to revert the 50-outputs back to the repo as well (duh) but this appears to work, i'll monitor for a while

**Comment by a3ilson** [comment]
Excellent/thanks!

The NGINX simply added a process within 05-apps.conf with a correlating grok pattern in pfelk.grok and one tweak to the 30-geoip.conf to enrich NGINX logs.

The new output utilizes datastreams and ILM but the prior version will work fine (legacy indices).

**Comment by revere521** [comment]
looks like everything has been fine for the last 5 hrs, this should be the correct fix

i will be looking into updating to current again in the next few days to see what the nginx stuff does as well
